### ISSUE TITLE
netapp-master9.bkp.bf1 to node03 test2

### ISSUE THREAD

**Issue by senthily** [senthily/log#4]
-bash-4.1$ sudo tcpdump -i eth0 dst 69.147.73.26 -v
Touch Yubikey:
tcpdump: listening on eth0, link-type EN10MB (Ethernet), capture size 65535 bytes
23:54:23.477155 IP (tos 0x0, ttl 64, id 60384, offset 0, flags [DF], proto TCP (6), length 80)
    netapp-master9.bkp.bf1.yahoo.com.35558 > node03.hff01.bf1.yahoo.com.ndmp: Flags [P.], cksum 0xb478 (incorrect -> 0x5d75), seq 808922088:808922116, ack 1088116786, win 170, options [nop,nop,TS val 1082787063 ecr 1933106710], length 28
23:54:23.477635 IP (tos 0x0, ttl 64, id 60385, offset 0, flags [DF], proto TCP (6), length 52)
    netapp-master9.bkp.bf1.yahoo.com.35558 > node03.hff01.bf1.yahoo.com.ndmp: Flags [.], cksum 0x6fd6 (correct), ack 105, win 170, options [nop,nop,TS val 1082787064 ecr 1933111716], length 0
23:54:27.665010 IP (tos 0x0, ttl 64, id 44738, offset 0, flags [DF], proto TCP (6), length 80)
    netapp-master9.bkp.bf1.yahoo.com.42181 > node03.hff01.bf1.yahoo.com.ndmp: Flags [P.], cksum 0xb478 (incorrect -> 0x5b1e), seq 702080684:702080712, ack 3935370401, win 148, options [nop,nop,TS val 1082791251 ecr 3337773059], length 28
23:54:27.667656 IP (tos 0x0, ttl 64, id 44739, offset 0, flags [DF], proto TCP (6), length 52)
    netapp-master9.bkp.bf1.yahoo.com.42181 > node03.hff01.bf1.yahoo.com.ndmp: Flags [.], cksum 0x6d7a (correct), ack 105, win 148, options [nop,nop,TS val 1082791254 ecr 3337778068], length 0
23:54:28.483167 IP (tos 0x0, ttl 64, id 60386, offset 0, flags [DF], proto TCP (6), length 80)
    netapp-master9.bkp.bf1.yahoo.com.35558 > node03.hff01.bf1.yahoo.com.ndmp: Flags [P.], cksum 0xb478 (incorrect -> 0x35cf), seq 28:56, ack 105, win 170, options [nop,nop,TS val 1082792069 ecr 1933111716], length 28
23:54:28.484011 IP (tos 0x0, ttl 64, id 60387, offset 0, flags [DF], proto TCP (6), length 52)
    netapp-master9.bkp.bf1.yahoo.com.35558 > node03.hff01.bf1.yahoo.com.ndmp: Flags [.], cksum 0x4835 (correct), ack 209, win 170, options [nop,nop,TS val 1082792070 ecr 1933116723], length 0
23:54:29.100444 IP (tos 0x0, ttl 64, id 51782, offset 0, flags [DF], proto TCP (6), length 60)
    netapp-master9.bkp.bf1.yahoo.com.51432 > node03.hff01.bf1.yahoo.com.ndmp: Flags [S], cksum 0xeebd (correct), seq 1340657833, win 14600, options [mss 1460,sackOK,TS val 1082792687 ecr 0,nop,wscale 7], length 0
23:54:29.103851 IP (tos 0x0, ttl 64, id 51783, offset 0, flags [DF], proto TCP (6), length 52)
    netapp-master9.bkp.bf1.yahoo.com.51432 > node03.hff01.bf1.yahoo.com.ndmp: Flags [.], cksum 0x40d5 (correct), ack 2628388714, win 115, options [nop,nop,TS val 1082792690 ecr 3019226412], length 0
23:54:31.414867 IP (tos 0x0, ttl 64, id 51784, offset 0, flags [DF], proto TCP (6), length 52)
    netapp-master9.bkp.bf1.yahoo.com.51432 > node03.hff01.bf1.yahoo.com.ndmp: Flags [.], cksum 0x2e85 (correct), ack 65, win 115, options [nop,nop,TS val 1082795001 ecr 3019228725], length 0
23:54:31.415438 IP (tos 0x0, ttl 64, id 51785, offset 0, flags [DF], proto TCP (6), length 84)
    netapp-master9.bkp.bf1.yahoo.com.51432 > node03.hff01.bf1.yahoo.com.ndmp: Flags [P.], cksum 0xb47c (incorrect -> 0x1371), seq 0:32, ack 65, win 115, options [nop,nop,TS val 1082795002 ecr 3019228725], length 32
23:54:31.416328 IP (tos 0x0, ttl 64, id 51786, offset 0, flags [DF], proto TCP (6), length 80)
    netapp-master9.bkp.bf1.yahoo.com.51432 > node03.hff01.bf1.yahoo.com.ndmp: Flags [P.], cksum 0xb478 (incorrect -> 0x1b3a), seq 32:60, ack 97, win 115, options [nop,nop,TS val 1082795003 ecr 3019228726], length 28
23:54:31.417374 IP (tos 0x0, ttl 64, id 51787, offset 0, flags [DF], proto TCP (6), length 80)
    netapp-master9.bkp.bf1.yahoo.com.51432 > node03.hff01.bf1.yahoo.com.ndmp: Flags [P.], cksum 0xb478 (incorrect -> 0x1af7), seq 60:88, ack 125, win 115, options [nop,nop,TS val 1082795004 ecr 3019228727], length 28
23:54:31.420040 IP (tos 0x0, ttl 64, id 51788, offset 0, flags [DF], proto TCP (6), length 84)
    netapp-master9.bkp.bf1.yahoo.com.51432 > node03.hff01.bf1.yahoo.com.ndmp: Flags [P.], cksum 0xb47c (incorrect -> 0x1a98), seq 88:120, ack 181, win 115, options [nop,nop,TS val 1082795006 ecr 3019228730], length 32
23:54:31.420942 IP (tos 0x0, ttl 64, id 51789, offset 0, flags [DF], proto TCP (6), length 108)
    netapp-master9.bkp.bf1.yahoo.com.51432 > node03.hff01.bf1.yahoo.com.ndmp: Flags [P.], cksum 0xb494 (incorrect -> 0x2bf3), seq 120:176, ack 281, win 115, options [nop,nop,TS val 1082795007 ecr 3019228731], length 56
23:54:31.421676 IP (tos 0x0, ttl 64, id 51790, offset 0, flags [DF], proto TCP (6), length 80)
    netapp-master9.bkp.bf1.yahoo.com.51432 > node03.hff01.bf1.yahoo.com.ndmp: Flags [P.], cksum 0xb478 (incorrect -> 0x19c3), seq 176:204, ack 313, win 115, options [nop,nop,TS val 1082795008 ecr 3019228732], length 28
23:54:31.461258 IP (tos 0x0, ttl 64, id 51791, offset 0, flags [DF], proto TCP (6), length 52)
    netapp-master9.bkp.bf1.yahoo.com.51432 > node03.hff01.bf1.yahoo.com.ndmp: Flags [.], cksum 0x2c3f (correct), ack 389, win 115, options [nop,nop,TS val 1082795048 ecr 3019228732], length 0
23:54:31.461721 IP (tos 0x0, ttl 64, id 51792, offset 0, flags [DF], proto TCP (6), length 52)
    netapp-master9.bkp.bf1.yahoo.com.51432 > node03.hff01.bf1.yahoo.com.ndmp: Flags [.], cksum 0x2baf (correct), ack 493, win 115, options [nop,nop,TS val 1082795048 ecr 3019228772], length 0
23:54:31.462146 IP (tos 0x0, ttl 64, id 51793, offset 0, flags [DF], proto TCP (6), length 80)
    netapp-master9.bkp.bf1.yahoo.com.51432 > node03.hff01.bf1.yahoo.com.ndmp: Flags [P.], cksum 0xb478 (incorrect -> 0x189a), seq 204:232, ack 493, win 115, options [nop,nop,TS val 1082795048 ecr 3019228772], length 28
23:54:31.462949 IP (tos 0x0, ttl 64, id 51794, offset 0, flags [DF], proto TCP (6), length 84)
    netapp-master9.bkp.bf1.yahoo.com.51432 > node03.hff01.bf1.yahoo.com.ndmp: Flags [P.], cksum 0xb47c (incorrect -> 0x17fe), seq 232:264, ack 613, win 115, options [nop,nop,TS val 1082795049 ecr 3019228773], length 32
23:54:31.463689 IP (tos 0x0, ttl 64, id 51795, offset 0, flags [DF], proto TCP (6), length 80)
    netapp-master9.bkp.bf1.yahoo.com.51432 > node03.hff01.bf1.yahoo.com.ndmp: Flags [P.], cksum 0xb478 (incorrect -> 0x1782), seq 264:292, ack 713, win 115, options [nop,nop,TS val 1082795050 ecr 3019228774], length 28
23:54:31.464552 IP (tos 0x0, ttl 64, id 51796, offset 0, flags [DF], proto TCP (6), length 80)
    netapp-master9.bkp.bf1.yahoo.com.51432 > node03.hff01.bf1.yahoo.com.ndmp: Flags [P.], cksum 0xb478 (incorrect -> 0x1736), seq 292:320, ack 757, win 115, options [nop,nop,TS val 1082795051 ecr 3019228774], length 28
23:54:31.488786 IP (tos 0x0, ttl 64, id 51797, offset 0, flags [DF], proto TCP (6), length 80)
    netapp-master9.bkp.bf1.yahoo.com.51432 > node03.hff01.bf1.yahoo.com.ndmp: Flags [P.], cksum 0xb478 (incorrect -> 0x1427), seq 320:348, ack 1469, win 126, options [nop,nop,TS val 1082795075 ecr 3019228775], length 28
23:54:31.513736 IP (tos 0x0, ttl 64, id 51798, offset 0, flags [DF], proto TCP (6), length 80)
    netapp-master9.bkp.bf1.yahoo.com.51432 > node03.hff01.bf1.yahoo.com.ndmp: Flags [P.], cksum 0xb478 (incorrect -> 0x13ae), seq 348:376, ack 1517, win 126, options [nop,nop,TS val 1082795100 ecr 3019228802], length 28
23:54:31.553250 IP (tos 0x0, ttl 64, id 51799, offset 0, flags [DF], proto TCP (6), length 52)
    netapp-master9.bkp.bf1.yahoo.com.51432 > node03.hff01.bf1.yahoo.com.ndmp: Flags [.], cksum 0x263c (correct), ack 1561, win 126, options [nop,nop,TS val 1082795140 ecr 3019228824], length 0
23:54:32.673227 IP (tos 0x0, ttl 64, id 44740, offset 0, flags [DF], proto TCP (6), length 80)
    netapp-master9.bkp.bf1.yahoo.com.42181 > node03.hff01.bf1.yahoo.com.ndmp: Flags [P.], cksum 0xb478 (incorrect -> 0x3373), seq 28:56, ack 105, win 148, options [nop,nop,TS val 1082796259 ecr 3337778068], length 28
23:54:32.675389 IP (tos 0x0, ttl 64, id 44741, offset 0, flags [DF], proto TCP (6), length 52)
    netapp-master9.bkp.bf1.yahoo.com.42181 > node03.hff01.bf1.yahoo.com.ndmp: Flags [.], cksum 0x45d7 (correct), ack 209, win 148, options [nop,nop,TS val 1082796262 ecr 3337783075], length 0
23:54:33.489567 IP (tos 0x0, ttl 64, id 60388, offset 0, flags [DF], proto TCP (6), length 80)
    netapp-master9.bkp.bf1.yahoo.com.35558 > node03.hff01.bf1.yahoo.com.ndmp: Flags [P.], cksum 0xb478 (incorrect -> 0x0e27), seq 56:84, ack 209, win 170, options [nop,nop,TS val 1082797076 ecr 1933116723], length 28
23:54:33.490139 IP (tos 0x0, ttl 64, id 60389, offset 0, flags [DF], proto TCP (6), length 52)
    netapp-master9.bkp.bf1.yahoo.com.35558 > node03.hff01.bf1.yahoo.com.ndmp: Flags [.], cksum 0x2095 (correct), ack 313, win 170, options [nop,nop,TS val 1082797076 ecr 1933121729], length 0
23:54:37.680915 IP (tos 0x0, ttl 64, id 44742, offset 0, flags [DF], proto TCP (6), length 80)
    netapp-master9.bkp.bf1.yahoo.com.42181 > node03.hff01.bf1.yahoo.com.ndmp: Flags [P.], cksum 0xb478 (incorrect -> 0x0bca), seq 56:84, ack 209, win 148, options [nop,nop,TS val 1082801267 ecr 3337783075], length 28
23:54:37.681430 IP (tos 0x0, ttl 64, id 44743, offset 0, flags [DF], proto TCP (6), length 52)
    netapp-master9.bkp.bf1.yahoo.com.42181 > node03.hff01.bf1.yahoo.com.ndmp: Flags [.], cksum 0x1e37 (correct), ack 313, win 148, options [nop,nop,TS val 1082801268 ecr 3337788081], length 0
23:54:38.495753 IP (tos 0x0, ttl 64, id 60390, offset 0, flags [DF], proto TCP (6), length 80)
    netapp-master9.bkp.bf1.yahoo.com.35558 > node03.hff01.bf1.yahoo.com.ndmp: Flags [P.], cksum 0xb478 (incorrect -> 0xe680), seq 84:112, ack 313, win 170, options [nop,nop,TS val 1082802082 ecr 1933121729], length 28
23:54:38.496290 IP (tos 0x0, ttl 64, id 60391, offset 0, flags [DF], proto TCP (6), length 52)
    netapp-master9.bkp.bf1.yahoo.com.35558 > node03.hff01.bf1.yahoo.com.ndmp: Flags [.], cksum 0xf8f3 (correct), ack 417, win 170, options [nop,nop,TS val 1082802083 ecr 1933126735], length 0
23:54:42.686956 IP (tos 0x0, ttl 64, id 44744, offset 0, flags [DF], proto TCP (6), length 80)
    netapp-master9.bkp.bf1.yahoo.com.42181 > node03.hff01.bf1.yahoo.com.ndmp: Flags [P.], cksum 0xb478 (incorrect -> 0xe423), seq 84:112, ack 313, win 148, options [nop,nop,TS val 1082806273 ecr 3337788081], length 28
23:54:42.687462 IP (tos 0x0, ttl 64, id 44745, offset 0, flags [DF], proto TCP (6), length 52)
    netapp-master9.bkp.bf1.yahoo.com.42181 > node03.hff01.bf1.yahoo.com.ndmp: Flags [.], cksum 0xf696 (correct), ack 417, win 148, options [nop,nop,TS val 1082806274 ecr 3337793087], length 0
23:54:43.501925 IP (tos 0x0, ttl 64, id 60392, offset 0, flags [DF], proto TCP (6), length 80)
    netapp-master9.bkp.bf1.yahoo.com.35558 > node03.hff01.bf1.yahoo.com.ndmp: Flags [P.], cksum 0xb478 (incorrect -> 0xbeda), seq 112:140, ack 417, win 170, options [nop,nop,TS val 1082807088 ecr 1933126735], length 28
23:54:43.502414 IP (tos 0x0, ttl 64, id 60393, offset 0, flags [DF], proto TCP (6), length 52)
    netapp-master9.bkp.bf1.yahoo.com.35558 > node03.hff01.bf1.yahoo.com.ndmp: Flags [.], cksum 0xd153 (correct), ack 521, win 170, options [nop,nop,TS val 1082807089 ecr 1933131741], length 0
23:54:47.692975 IP (tos 0x0, ttl 64, id 44746, offset 0, flags [DF], proto TCP (6), length 80)
    netapp-master9.bkp.bf1.yahoo.com.42181 > node03.hff01.bf1.yahoo.com.ndmp: Flags [P.], cksum 0xb478 (incorrect -> 0xbc7d), seq 112:140, ack 417, win 148, options [nop,nop,TS val 1082811279 ecr 3337793087], length 28
23:54:47.693430 IP (tos 0x0, ttl 64, id 44747, offset 0, flags [DF], proto TCP (6), length 52)
    netapp-master9.bkp.bf1.yahoo.com.42181 > node03.hff01.bf1.yahoo.com.ndmp: Flags [.], cksum 0xcef5 (correct), ack 521, win 148, options [nop,nop,TS val 1082811280 ecr 3337798094], length 0
23:54:48.507411 IP (tos 0x0, ttl 64, id 60394, offset 0, flags [DF], proto TCP (6), length 80)
    netapp-master9.bkp.bf1.yahoo.com.35558 > node03.hff01.bf1.yahoo.com.ndmp: Flags [P.], cksum 0xb478 (incorrect -> 0x9734), seq 140:168, ack 521, win 170, options [nop,nop,TS val 1082812094 ecr 1933131741], length 28
23:54:48.508275 IP (tos 0x0, ttl 64, id 60395, offset 0, flags [DF], proto TCP (6), length 52)
    netapp-master9.bkp.bf1.yahoo.com.35558 > node03.hff01.bf1.yahoo.com.ndmp: Flags [.], cksum 0xa9b3 (correct), ack 625, win 170, options [nop,nop,TS val 1082812095 ecr 1933136747], length 0
23:54:52.698974 IP (tos 0x0, ttl 64, id 44748, offset 0, flags [DF], proto TCP (6), length 80)
    netapp-master9.bkp.bf1.yahoo.com.42181 > node03.hff01.bf1.yahoo.com.ndmp: Flags [P.], cksum 0xb478 (incorrect -> 0x94d6), seq 140:168, ack 521, win 148, options [nop,nop,TS val 1082816285 ecr 3337798094], length 28
23:54:52.699681 IP (tos 0x0, ttl 64, id 44749, offset 0, flags [DF], proto TCP (6), length 52)
    netapp-master9.bkp.bf1.yahoo.com.42181 > node03.hff01.bf1.yahoo.com.ndmp: Flags [.], cksum 0xa755 (correct), ack 625, win 148, options [nop,nop,TS val 1082816286 ecr 3337803100], length 0
23:54:53.513863 IP (tos 0x0, ttl 64, id 60396, offset 0, flags [DF], proto TCP (6), length 80)
    netapp-master9.bkp.bf1.yahoo.com.35558 > node03.hff01.bf1.yahoo.com.ndmp: Flags [P.], cksum 0xb478 (incorrect -> 0x6f8e), seq 168:196, ack 625, win 170, options [nop,nop,TS val 1082817100 ecr 1933136747], length 28
23:54:53.514480 IP (tos 0x0, ttl 64, id 60397, offset 0, flags [DF], proto TCP (6), length 52)
    netapp-master9.bkp.bf1.yahoo.com.35558 > node03.hff01.bf1.yahoo.com.ndmp: Flags [.], cksum 0x8213 (correct), ack 729, win 170, options [nop,nop,TS val 1082817101 ecr 1933141753], length 0
23:54:57.703015 IP (tos 0x0, ttl 64, id 44750, offset 0, flags [DF], proto TCP (6), length 80)
    netapp-master9.bkp.bf1.yahoo.com.42181 > node03.hff01.bf1.yahoo.com.ndmp: Flags [P.], cksum 0xb478 (incorrect -> 0x6d32), seq 168:196, ack 625, win 148, options [nop,nop,TS val 1082821289 ecr 3337803100], length 28
23:54:57.703500 IP (tos 0x0, ttl 64, id 44751, offset 0, flags [DF], proto TCP (6), length 52)
    netapp-master9.bkp.bf1.yahoo.com.42181 > node03.hff01.bf1.yahoo.com.ndmp: Flags [.], cksum 0x7fba (correct), ack 729, win 148, options [nop,nop,TS val 1082821290 ecr 3337808103], length 0
23:54:58.519402 IP (tos 0x0, ttl 64, id 60398, offset 0, flags [DF], proto TCP (6), length 80)
    netapp-master9.bkp.bf1.yahoo.com.35558 > node03.hff01.bf1.yahoo.com.ndmp: Flags [P.], cksum 0xb478 (incorrect -> 0x47e8), seq 196:224, ack 729, win 170, options [nop,nop,TS val 1082822106 ecr 1933141753], length 28
23:54:58.519941 IP (tos 0x0, ttl 64, id 60399, offset 0, flags [DF], proto TCP (6), length 52)
    netapp-master9.bkp.bf1.yahoo.com.35558 > node03.hff01.bf1.yahoo.com.ndmp: Flags [.], cksum 0x5a74 (correct), ack 833, win 170, options [nop,nop,TS val 1082822106 ecr 1933146759], length 0
23:55:02.709068 IP (tos 0x0, ttl 64, id 44752, offset 0, flags [DF], proto TCP (6), length 80)
    netapp-master9.bkp.bf1.yahoo.com.42181 > node03.hff01.bf1.yahoo.com.ndmp: Flags [P.], cksum 0xb478 (incorrect -> 0x458f), seq 196:224, ack 729, win 148, options [nop,nop,TS val 1082826295 ecr 3337808103], length 28
23:55:02.711380 IP (tos 0x0, ttl 64, id 44753, offset 0, flags [DF], proto TCP (6), length 52)
    netapp-master9.bkp.bf1.yahoo.com.42181 > node03.hff01.bf1.yahoo.com.ndmp: Flags [.], cksum 0x5816 (correct), ack 833, win 148, options [nop,nop,TS val 1082826298 ecr 3337813111], length 0
23:55:03.525445 IP (tos 0x0, ttl 64, id 60400, offset 0, flags [DF], proto TCP (6), length 80)
    netapp-master9.bkp.bf1.yahoo.com.35558 > node03.hff01.bf1.yahoo.com.ndmp: Flags [P.], cksum 0xb478 (incorrect -> 0x2042), seq 224:252, ack 833, win 170, options [nop,nop,TS val 1082827112 ecr 1933146759], length 28
23:55:03.525956 IP (tos 0x0, ttl 64, id 60401, offset 0, flags [DF], proto TCP (6), length 52)
    netapp-master9.bkp.bf1.yahoo.com.35558 > node03.hff01.bf1.yahoo.com.ndmp: Flags [.], cksum 0x32d4 (correct), ack 937, win 170, options [nop,nop,TS val 1082827112 ecr 1933151765], length 0
23:55:07.711790 IP (tos 0x0, ttl 64, id 44754, offset 0, flags [DF], proto TCP (6), length 80)
    netapp-master9.bkp.bf1.yahoo.com.42181 > node03.hff01.bf1.yahoo.com.ndmp: Flags [P.], cksum 0xb478 (incorrect -> 0x1dea), seq 224:252, ack 833, win 148, options [nop,nop,TS val 1082831298 ecr 3337813111], length 28
23:55:07.712328 IP (tos 0x0, ttl 64, id 44755, offset 0, flags [DF], proto TCP (6), length 52)
    netapp-master9.bkp.bf1.yahoo.com.42181 > node03.hff01.bf1.yahoo.com.ndmp: Flags [.], cksum 0x307f (correct), ack 937, win 148, options [nop,nop,TS val 1082831299 ecr 3337818113], length 0
23:55:08.528331 IP (tos 0x0, ttl 64, id 60402, offset 0, flags [DF], proto TCP (6), length 80)
    netapp-master9.bkp.bf1.yahoo.com.35558 > node03.hff01.bf1.yahoo.com.ndmp: Flags [P.], cksum 0xb478 (incorrect -> 0xf89e), seq 252:280, ack 937, win 170, options [nop,nop,TS val 1082832115 ecr 1933151765], length 28
23:55:08.529120 IP (tos 0x0, ttl 64, id 60403, offset 0, flags [DF], proto TCP (6), length 52)
    netapp-master9.bkp.bf1.yahoo.com.35558 > node03.hff01.bf1.yahoo.com.ndmp: Flags [.], cksum 0x0b3a (correct), ack 1041, win 170, options [nop,nop,TS val 1082832115 ecr 1933156768], length 0
23:55:12.717928 IP (tos 0x0, ttl 64, id 44756, offset 0, flags [DF], proto TCP (6), length 80)
    netapp-master9.bkp.bf1.yahoo.com.42181 > node03.hff01.bf1.yahoo.com.ndmp: Flags [P.], cksum 0xb478 (incorrect -> 0xf647), seq 252:280, ack 937, win 148, options [nop,nop,TS val 1082836304 ecr 3337818113], length 28
23:55:12.720644 IP (tos 0x0, ttl 64, id 44757, offset 0, flags [DF], proto TCP (6), length 52)
    netapp-master9.bkp.bf1.yahoo.com.42181 > node03.hff01.bf1.yahoo.com.ndmp: Flags [.], cksum 0x08db (correct), ack 1041, win 148, options [nop,nop,TS val 1082836307 ecr 3337823121], length 0
23:55:13.534715 IP (tos 0x0, ttl 64, id 60404, offset 0, flags [DF], proto TCP (6), length 80)
    netapp-master9.bkp.bf1.yahoo.com.35558 > node03.hff01.bf1.yahoo.com.ndmp: Flags [P.], cksum 0xb478 (incorrect -> 0xd0fb), seq 280:308, ack 1041, win 170, options [nop,nop,TS val 1082837121 ecr 1933156768], length 28
23:55:13.535215 IP (tos 0x0, ttl 64, id 60405, offset 0, flags [DF], proto TCP (6), length 52)
    netapp-master9.bkp.bf1.yahoo.com.35558 > node03.hff01.bf1.yahoo.com.ndmp: Flags [.], cksum 0xe399 (correct), ack 1145, win 170, options [nop,nop,TS val 1082837121 ecr 1933161774], length 0
23:55:13.868446 IP (tos 0x0, ttl 64, id 51457, offset 0, flags [DF], proto TCP (6), length 52)
    netapp-master9.bkp.bf1.yahoo.com.58240 > node03.hff01.bf1.yahoo.com.ndmp: Flags [.], cksum 0x00dc (correct), ack 513287037, win 126, options [nop,nop,TS val 1082837455 ecr 907861415], length 0
23:55:17.726221 IP (tos 0x0, ttl 64, id 44758, offset 0, flags [DF], proto TCP (6), length 80)
    netapp-master9.bkp.bf1.yahoo.com.42181 > node03.hff01.bf1.yahoo.com.ndmp: Flags [P.], cksum 0xb478 (incorrect -> 0xce9d), seq 280:308, ack 1041, win 148, options [nop,nop,TS val 1082841312 ecr 3337823121], length 28
23:55:17.726949 IP (tos 0x0, ttl 64, id 44759, offset 0, flags [DF], proto TCP (6), length 52)
    netapp-master9.bkp.bf1.yahoo.com.42181 > node03.hff01.bf1.yahoo.com.ndmp: Flags [.], cksum 0xe13a (correct), ack 1145, win 148, options [nop,nop,TS val 1082841313 ecr 3337828127], length 0
23:55:18.540886 IP (tos 0x0, ttl 64, id 60406, offset 0, flags [DF], proto TCP (6), length 80)
    netapp-master9.bkp.bf1.yahoo.com.35558 > node03.hff01.bf1.yahoo.com.ndmp: Flags [P.], cksum 0xb478 (incorrect -> 0xa955), seq 308:336, ack 1145, win 170, options [nop,nop,TS val 1082842127 ecr 1933161774], length 28
23:55:18.541440 IP (tos 0x0, ttl 64, id 60407, offset 0, flags [DF], proto TCP (6), length 52)
    netapp-master9.bkp.bf1.yahoo.com.35558 > node03.hff01.bf1.yahoo.com.ndmp: Flags [.], cksum 0xbbf8 (correct), ack 1249, win 170, options [nop,nop,TS val 1082842128 ecr 1933166780], length 0
23:55:22.732549 IP (tos 0x0, ttl 64, id 44760, offset 0, flags [DF], proto TCP (6), length 80)
    netapp-master9.bkp.bf1.yahoo.com.42181 > node03.hff01.bf1.yahoo.com.ndmp: Flags [P.], cksum 0xb478 (incorrect -> 0xa6f6), seq 308:336, ack 1145, win 148, options [nop,nop,TS val 1082846319 ecr 3337828127], length 28
23:55:22.733019 IP (tos 0x0, ttl 64, id 44761, offset 0, flags [DF], proto TCP (6), length 52)
    netapp-master9.bkp.bf1.yahoo.com.42181 > node03.hff01.bf1.yahoo.com.ndmp: Flags [.], cksum 0xb99a (correct), ack 1249, win 148, options [nop,nop,TS val 1082846319 ecr 3337833133], length 0
23:55:23.547089 IP (tos 0x0, ttl 64, id 60408, offset 0, flags [DF], proto TCP (6), length 80)
    netapp-master9.bkp.bf1.yahoo.com.35558 > node03.hff01.bf1.yahoo.com.ndmp: Flags [P.], cksum 0xb478 (incorrect -> 0x81af), seq 336:364, ack 1249, win 170, options [nop,nop,TS val 1082847133 ecr 1933166780], length 28
23:55:23.547623 IP (tos 0x0, ttl 64, id 60409, offset 0, flags [DF], proto TCP (6), length 52)
    netapp-master9.bkp.bf1.yahoo.com.35558 > node03.hff01.bf1.yahoo.com.ndmp: Flags [.], cksum 0x9457 (correct), ack 1353, win 170, options [nop,nop,TS val 1082847134 ecr 1933171787], length 0
23:55:24.003029 IP (tos 0x0, ttl 64, id 60410, offset 0, flags [DF], proto TCP (6), length 52)
    netapp-master9.bkp.bf1.yahoo.com.35558 > node03.hff01.bf1.yahoo.com.ndmp: Flags [.], cksum 0x9059 (correct), ack 1465, win 170, options [nop,nop,TS val 1082847589 ecr 1933172242], length 0
23:55:27.738613 IP (tos 0x0, ttl 64, id 44762, offset 0, flags [DF], proto TCP (6), length 80)
    netapp-master9.bkp.bf1.yahoo.com.42181 > node03.hff01.bf1.yahoo.com.ndmp: Flags [P.], cksum 0xb478 (incorrect -> 0x7f50), seq 336:364, ack 1249, win 148, options [nop,nop,TS val 1082851325 ecr 3337833133], length 28
23:55:27.739145 IP (tos 0x0, ttl 64, id 44763, offset 0, flags [DF], proto TCP (6), length 52)
    netapp-master9.bkp.bf1.yahoo.com.42181 > node03.hff01.bf1.yahoo.com.ndmp: Flags [.], cksum 0x91fa (correct), ack 1353, win 148, options [nop,nop,TS val 1082851325 ecr 3337838139], length 0
23:55:28.552452 IP (tos 0x0, ttl 64, id 60411, offset 0, flags [DF], proto TCP (6), length 80)
    netapp-master9.bkp.bf1.yahoo.com.35558 > node03.hff01.bf1.yahoo.com.ndmp: Flags [P.], cksum 0xb478 (incorrect -> 0x57d1), seq 364:392, ack 1465, win 170, options [nop,nop,TS val 1082852139 ecr 1933172242], length 28
23:55:28.553174 IP (tos 0x0, ttl 64, id 60412, offset 0, flags [DF], proto TCP (6), length 52)
    netapp-master9.bkp.bf1.yahoo.com.35558 > node03.hff01.bf1.yahoo.com.ndmp: Flags [.], cksum 0x6c49 (correct), ack 1569, win 170, options [nop,nop,TS val 1082852139 ecr 1933176792], length 0
23:55:32.744739 IP (tos 0x0, ttl 64, id 44764, offset 0, flags [DF], proto TCP (6), length 80)
    netapp-master9.bkp.bf1.yahoo.com.42181 > node03.hff01.bf1.yahoo.com.ndmp: Flags [P.], cksum 0xb478 (incorrect -> 0x57aa), seq 364:392, ack 1353, win 148, options [nop,nop,TS val 1082856331 ecr 3337838139], length 28
23:55:32.745537 IP (tos 0x0, ttl 64, id 44765, offset 0, flags [DF], proto TCP (6), length 52)
    netapp-master9.bkp.bf1.yahoo.com.42181 > node03.hff01.bf1.yahoo.com.ndmp: Flags [.], cksum 0x6a58 (correct), ack 1457, win 148, options [nop,nop,TS val 1082856332 ecr 3337843146], length 0
23:55:33.558798 IP (tos 0x0, ttl 64, id 60413, offset 0, flags [DF], proto TCP (6), length 80)
    netapp-master9.bkp.bf1.yahoo.com.35558 > node03.hff01.bf1.yahoo.com.ndmp: Flags [P.], cksum 0xb478 (incorrect -> 0x31f3), seq 392:420, ack 1569, win 170, options [nop,nop,TS val 1082857145 ecr 1933176792], length 28
23:55:33.559351 IP (tos 0x0, ttl 64, id 60414, offset 0, flags [DF], proto TCP (6), length 52)
    netapp-master9.bkp.bf1.yahoo.com.35558 > node03.hff01.bf1.yahoo.com.ndmp: Flags [.], cksum 0x44a8 (correct), ack 1673, win 170, options [nop,nop,TS val 1082857146 ecr 1933181798], length 0
23:55:37.751060 IP (tos 0x0, ttl 64, id 44766, offset 0, flags [DF], proto TCP (6), length 80)
    netapp-master9.bkp.bf1.yahoo.com.42181 > node03.hff01.bf1.yahoo.com.ndmp: Flags [P.], cksum 0xb478 (incorrect -> 0x3003), seq 392:420, ack 1457, win 148, options [nop,nop,TS val 1082861337 ecr 3337843146], length 28
23:55:37.751512 IP (tos 0x0, ttl 64, id 44767, offset 0, flags [DF], proto TCP (6), length 52)
    netapp-master9.bkp.bf1.yahoo.com.42181 > node03.hff01.bf1.yahoo.com.ndmp: Flags [.], cksum 0x42b9 (correct), ack 1561, win 148, options [nop,nop,TS val 1082861338 ecr 3337848151], length 0
23:55:38.564931 IP (tos 0x0, ttl 64, id 60415, offset 0, flags [DF], proto TCP (6), length 80)
    netapp-master9.bkp.bf1.yahoo.com.35558 > node03.hff01.bf1.yahoo.com.ndmp: Flags [P.], cksum 0xb478 (incorrect -> 0x0a4d), seq 420:448, ack 1673, win 170, options [nop,nop,TS val 1082862151 ecr 1933181798], length 28
23:55:38.565421 IP (tos 0x0, ttl 64, id 60416, offset 0, flags [DF], proto TCP (6), length 52)
    netapp-master9.bkp.bf1.yahoo.com.35558 > node03.hff01.bf1.yahoo.com.ndmp: Flags [.], cksum 0x1d08 (correct), ack 1777, win 170, options [nop,nop,TS val 1082862152 ecr 1933186804], length 0
23:55:42.757033 IP (tos 0x0, ttl 64, id 44768, offset 0, flags [DF], proto TCP (6), length 80)
    netapp-master9.bkp.bf1.yahoo.com.42181 > node03.hff01.bf1.yahoo.com.ndmp: Flags [P.], cksum 0xb478 (incorrect -> 0x085e), seq 420:448, ack 1561, win 148, options [nop,nop,TS val 1082866343 ecr 3337848151], length 28
23:55:42.757550 IP (tos 0x0, ttl 64, id 44769, offset 0, flags [DF], proto TCP (6), length 52)
    netapp-master9.bkp.bf1.yahoo.com.42181 > node03.hff01.bf1.yahoo.com.ndmp: Flags [.], cksum 0x1b18 (correct), ack 1665, win 148, options [nop,nop,TS val 1082866344 ecr 3337853158], length 0
23:55:43.571042 IP (tos 0x0, ttl 64, id 60417, offset 0, flags [DF], proto TCP (6), length 80)
    netapp-master9.bkp.bf1.yahoo.com.35558 > node03.hff01.bf1.yahoo.com.ndmp: Flags [P.], cksum 0xb478 (incorrect -> 0xe2a6), seq 448:476, ack 1777, win 170, options [nop,nop,TS val 1082867157 ecr 1933186804], length 28
23:55:43.574890 IP (tos 0x0, ttl 64, id 60418, offset 0, flags [DF], proto TCP (6), length 52)
    netapp-master9.bkp.bf1.yahoo.com.35558 > node03.hff01.bf1.yahoo.com.ndmp: Flags [.], cksum 0xf560 (correct), ack 1881, win 170, options [nop,nop,TS val 1082867161 ecr 1933191814], length 0
23:55:47.763080 IP (tos 0x0, ttl 64, id 44770, offset 0, flags [DF], proto TCP (6), length 80)
    netapp-master9.bkp.bf1.yahoo.com.42181 > node03.hff01.bf1.yahoo.com.ndmp: Flags [P.], cksum 0xb478 (incorrect -> 0xe0b6), seq 448:476, ack 1665, win 148, options [nop,nop,TS val 1082871349 ecr 3337853158], length 28
23:55:47.763562 IP (tos 0x0, ttl 64, id 44771, offset 0, flags [DF], proto TCP (6), length 52)
    netapp-master9.bkp.bf1.yahoo.com.42181 > node03.hff01.bf1.yahoo.com.ndmp: Flags [.], cksum 0xf377 (correct), ack 1769, win 148, options [nop,nop,TS val 1082871350 ecr 3337858164], length 0
23:55:48.580466 IP (tos 0x0, ttl 64, id 60419, offset 0, flags [DF], proto TCP (6), length 80)
    netapp-master9.bkp.bf1.yahoo.com.35558 > node03.hff01.bf1.yahoo.com.ndmp: Flags [P.], cksum 0xb478 (incorrect -> 0xbaf8), seq 476:504, ack 1881, win 170, options [nop,nop,TS val 1082872167 ecr 1933191814], length 28
23:55:48.581230 IP (tos 0x0, ttl 64, id 60420, offset 0, flags [DF], proto TCP (6), length 52)
    netapp-master9.bkp.bf1.yahoo.com.35558 > node03.hff01.bf1.yahoo.com.ndmp: Flags [.], cksum 0xcdc0 (correct), ack 1985, win 170, options [nop,nop,TS val 1082872167 ecr 1933196820], length 0
23:55:52.769024 IP (tos 0x0, ttl 64, id 44772, offset 0, flags [DF], proto TCP (6), length 80)
    netapp-master9.bkp.bf1.yahoo.com.42181 > node03.hff01.bf1.yahoo.com.ndmp: Flags [P.], cksum 0xb478 (incorrect -> 0xb910), seq 476:504, ack 1769, win 148, options [nop,nop,TS val 1082876355 ecr 3337858164], length 28
23:55:52.770188 IP (tos 0x0, ttl 64, id 44773, offset 0, flags [DF], proto TCP (6), length 52)
    netapp-master9.bkp.bf1.yahoo.com.42181 > node03.hff01.bf1.yahoo.com.ndmp: Flags [.], cksum 0xcbd7 (correct), ack 1873, win 148, options [nop,nop,TS val 1082876356 ecr 3337863170], length 0
23:55:53.586337 IP (tos 0x0, ttl 64, id 60421, offset 0, flags [DF], proto TCP (6), length 80)
    netapp-master9.bkp.bf1.yahoo.com.35558 > node03.hff01.bf1.yahoo.com.ndmp: Flags [P.], cksum 0xb478 (incorrect -> 0x9352), seq 504:532, ack 1985, win 170, options [nop,nop,TS val 1082877173 ecr 1933196820], length 28
23:55:53.586912 IP (tos 0x0, ttl 64, id 60422, offset 0, flags [DF], proto TCP (6), length 52)
    netapp-master9.bkp.bf1.yahoo.com.35558 > node03.hff01.bf1.yahoo.com.ndmp: Flags [.], cksum 0xa620 (correct), ack 2089, win 170, options [nop,nop,TS val 1082877173 ecr 1933201826], length 0
23:55:57.775714 IP (tos 0x0, ttl 64, id 44774, offset 0, flags [DF], proto TCP (6), length 80)
    netapp-master9.bkp.bf1.yahoo.com.42181 > node03.hff01.bf1.yahoo.com.ndmp: Flags [P.], cksum 0xb478 (incorrect -> 0x9169), seq 504:532, ack 1873, win 148, options [nop,nop,TS val 1082881362 ecr 3337863170], length 28
23:55:57.776555 IP (tos 0x0, ttl 64, id 44775, offset 0, flags [DF], proto TCP (6), length 52)
    netapp-master9.bkp.bf1.yahoo.com.42181 > node03.hff01.bf1.yahoo.com.ndmp: Flags [.], cksum 0xa436 (correct), ack 1977, win 148, options [nop,nop,TS val 1082881363 ecr 3337868176], length 0
23:55:58.592423 IP (tos 0x0, ttl 64, id 60423, offset 0, flags [DF], proto TCP (6), length 80)
    netapp-master9.bkp.bf1.yahoo.com.35558 > node03.hff01.bf1.yahoo.com.ndmp: Flags [P.], cksum 0xb478 (incorrect -> 0x6bac), seq 532:560, ack 2089, win 170, options [nop,nop,TS val 1082882179 ecr 1933201826], length 28
23:55:58.593021 IP (tos 0x0, ttl 64, id 60424, offset 0, flags [DF], proto TCP (6), length 52)
    netapp-master9.bkp.bf1.yahoo.com.35558 > node03.hff01.bf1.yahoo.com.ndmp: Flags [.], cksum 0x7e80 (correct), ack 2193, win 170, options [nop,nop,TS val 1082882179 ecr 1933206832], length 0
23:56:02.782121 IP (tos 0x0, ttl 64, id 44776, offset 0, flags [DF], proto TCP (6), length 80)
    netapp-master9.bkp.bf1.yahoo.com.42181 > node03.hff01.bf1.yahoo.com.ndmp: Flags [P.], cksum 0xb478 (incorrect -> 0x69c3), seq 532:560, ack 1977, win 148, options [nop,nop,TS val 1082886368 ecr 3337868176], length 28
23:56:02.782602 IP (tos 0x0, ttl 64, id 44777, offset 0, flags [DF], proto TCP (6), length 52)
    netapp-master9.bkp.bf1.yahoo.com.42181 > node03.hff01.bf1.yahoo.com.ndmp: Flags [.], cksum 0x7c95 (correct), ack 2081, win 148, options [nop,nop,TS val 1082886369 ecr 3337873183], length 0
23:56:03.598741 IP (tos 0x0, ttl 64, id 60425, offset 0, flags [DF], proto TCP (6), length 80)
    netapp-master9.bkp.bf1.yahoo.com.35558 > node03.hff01.bf1.yahoo.com.ndmp: Flags [P.], cksum 0xb478 (incorrect -> 0x4406), seq 560:588, ack 2193, win 170, options [nop,nop,TS val 1082887185 ecr 1933206832], length 28
23:56:03.599278 IP (tos 0x0, ttl 64, id 60426, offset 0, flags [DF], proto TCP (6), length 52)
    netapp-master9.bkp.bf1.yahoo.com.35558 > node03.hff01.bf1.yahoo.com.ndmp: Flags [.], cksum 0x56de (correct), ack 2297, win 170, options [nop,nop,TS val 1082887186 ecr 1933211839], length 0
23:56:07.787144 IP (tos 0x0, ttl 64, id 44778, offset 0, flags [DF], proto TCP (6), length 80)
    netapp-master9.bkp.bf1.yahoo.com.42181 > node03.hff01.bf1.yahoo.com.ndmp: Flags [P.], cksum 0xb478 (incorrect -> 0x421d), seq 560:588, ack 2081, win 148, options [nop,nop,TS val 1082891373 ecr 3337873183], length 28
23:56:07.787613 IP (tos 0x0, ttl 64, id 44779, offset 0, flags [DF], proto TCP (6), length 52)
    netapp-master9.bkp.bf1.yahoo.com.42181 > node03.hff01.bf1.yahoo.com.ndmp: Flags [.], cksum 0x54f7 (correct), ack 2185, win 148, options [nop,nop,TS val 1082891374 ecr 3337878188], length 0
23:56:08.604813 IP (tos 0x0, ttl 64, id 60427, offset 0, flags [DF], proto TCP (6), length 80)
    netapp-master9.bkp.bf1.yahoo.com.35558 > node03.hff01.bf1.yahoo.com.ndmp: Flags [P.], cksum 0xb478 (incorrect -> 0x1c5f), seq 588:616, ack 2297, win 170, options [nop,nop,TS val 1082892191 ecr 1933211839], length 28
23:56:08.605507 IP (tos 0x0, ttl 64, id 60428, offset 0, flags [DF], proto TCP (6), length 52)
    netapp-master9.bkp.bf1.yahoo.com.35558 > node03.hff01.bf1.yahoo.com.ndmp: Flags [.], cksum 0x2f3e (correct), ack 2401, win 170, options [nop,nop,TS val 1082892192 ecr 1933216845], length 0
23:56:12.793106 IP (tos 0x0, ttl 64, id 44780, offset 0, flags [DF], proto TCP (6), length 80)
    netapp-master9.bkp.bf1.yahoo.com.42181 > node03.hff01.bf1.yahoo.com.ndmp: Flags [P.], cksum 0xb478 (incorrect -> 0x1a78), seq 588:616, ack 2185, win 148, options [nop,nop,TS val 1082896379 ecr 3337878188], length 28
23:56:12.793833 IP (tos 0x0, ttl 64, id 44781, offset 0, flags [DF], proto TCP (6), length 52)
    netapp-master9.bkp.bf1.yahoo.com.42181 > node03.hff01.bf1.yahoo.com.ndmp: Flags [.], cksum 0x2d57 (correct), ack 2289, win 148, options [nop,nop,TS val 1082896380 ecr 3337883194], length 0
23:56:13.611100 IP (tos 0x0, ttl 64, id 60429, offset 0, flags [DF], proto TCP (6), length 80)
    netapp-master9.bkp.bf1.yahoo.com.35558 > node03.hff01.bf1.yahoo.com.ndmp: Flags [P.], cksum 0xb478 (incorrect -> 0xf4b8), seq 616:644, ack 2401, win 170, options [nop,nop,TS val 1082897197 ecr 1933216845], length 28
23:56:13.611715 IP (tos 0x0, ttl 64, id 60430, offset 0, flags [DF], proto TCP (6), length 52)
    netapp-master9.bkp.bf1.yahoo.com.35558 > node03.hff01.bf1.yahoo.com.ndmp: Flags [.], cksum 0x079e (correct), ack 2505, win 170, options [nop,nop,TS val 1082897198 ecr 1933221851], length 0
23:56:17.799337 IP (tos 0x0, ttl 64, id 44782, offset 0, flags [DF], proto TCP (6), length 80)
    netapp-master9.bkp.bf1.yahoo.com.42181 > node03.hff01.bf1.yahoo.com.ndmp: Flags [P.], cksum 0xb478 (incorrect -> 0xf2d0), seq 616:644, ack 2289, win 148, options [nop,nop,TS val 1082901386 ecr 3337883194], length 28
23:56:17.799813 IP (tos 0x0, ttl 64, id 44783, offset 0, flags [DF], proto TCP (6), length 52)
    netapp-master9.bkp.bf1.yahoo.com.42181 > node03.hff01.bf1.yahoo.com.ndmp: Flags [.], cksum 0x05b7 (correct), ack 2393, win 148, options [nop,nop,TS val 1082901386 ecr 3337888200], length 0
23:56:18.617311 IP (tos 0x0, ttl 64, id 60431, offset 0, flags [DF], proto TCP (6), length 80)
    netapp-master9.bkp.bf1.yahoo.com.35558 > node03.hff01.bf1.yahoo.com.ndmp: Flags [P.], cksum 0xb478 (incorrect -> 0xcd11), seq 644:672, ack 2505, win 170, options [nop,nop,TS val 1082902204 ecr 1933221851], length 28
23:56:18.617801 IP (tos 0x0, ttl 64, id 60432, offset 0, flags [DF], proto TCP (6), length 52)
    netapp-master9.bkp.bf1.yahoo.com.35558 > node03.hff01.bf1.yahoo.com.ndmp: Flags [.], cksum 0xdffe (correct), ack 2609, win 170, options [nop,nop,TS val 1082902204 ecr 1933226856], length 0
23:56:22.805356 IP (tos 0x0, ttl 64, id 44784, offset 0, flags [DF], proto TCP (6), length 80)
    netapp-master9.bkp.bf1.yahoo.com.42181 > node03.hff01.bf1.yahoo.com.ndmp: Flags [P.], cksum 0xb478 (incorrect -> 0xcb2a), seq 644:672, ack 2393, win 148, options [nop,nop,TS val 1082906392 ecr 3337888200], length 28
23:56:22.805817 IP (tos 0x0, ttl 64, id 44785, offset 0, flags [DF], proto TCP (6), length 52)
    netapp-master9.bkp.bf1.yahoo.com.42181 > node03.hff01.bf1.yahoo.com.ndmp: Flags [.], cksum 0xde16 (correct), ack 2497, win 148, options [nop,nop,TS val 1082906392 ecr 3337893206], length 0
23:56:23.623366 IP (tos 0x0, ttl 64, id 60433, offset 0, flags [DF], proto TCP (6), length 80)
    netapp-master9.bkp.bf1.yahoo.com.35558 > node03.hff01.bf1.yahoo.com.ndmp: Flags [P.], cksum 0xb478 (incorrect -> 0xa56c), seq 672:700, ack 2609, win 170, options [nop,nop,TS val 1082907210 ecr 1933226856], length 28
23:56:23.623894 IP (tos 0x0, ttl 64, id 60434, offset 0, flags [DF], proto TCP (6), length 52)
    netapp-master9.bkp.bf1.yahoo.com.35558 > node03.hff01.bf1.yahoo.com.ndmp: Flags [.], cksum 0xb85d (correct), ack 2713, win 170, options [nop,nop,TS val 1082907210 ecr 1933231863], length 0
23:56:27.811359 IP (tos 0x0, ttl 64, id 44786, offset 0, flags [DF], proto TCP (6), length 80)
    netapp-master9.bkp.bf1.yahoo.com.42181 > node03.hff01.bf1.yahoo.com.ndmp: Flags [P.], cksum 0xb478 (incorrect -> 0xa384), seq 672:700, ack 2497, win 148, options [nop,nop,TS val 1082911398 ecr 3337893206], length 28
23:56:27.812041 IP (tos 0x0, ttl 64, id 44787, offset 0, flags [DF], proto TCP (6), length 52)
    netapp-master9.bkp.bf1.yahoo.com.42181 > node03.hff01.bf1.yahoo.com.ndmp: Flags [.], cksum 0xb676 (correct), ack 2601, win 148, options [nop,nop,TS val 1082911398 ecr 3337898212], length 0
23:56:28.629520 IP (tos 0x0, ttl 64, id 60435, offset 0, flags [DF], proto TCP (6), length 80)
    netapp-master9.bkp.bf1.yahoo.com.35558 > node03.hff01.bf1.yahoo.com.ndmp: Flags [P.], cksum 0xb478 (incorrect -> 0x7dc5), seq 700:728, ack 2713, win 170, options [nop,nop,TS val 1082912216 ecr 1933231863], length 28
23:56:28.630467 IP (tos 0x0, ttl 64, id 60436, offset 0, flags [DF], proto TCP (6), length 52)
    netapp-master9.bkp.bf1.yahoo.com.35558 > node03.hff01.bf1.yahoo.com.ndmp: Flags [.], cksum 0x90bb (correct), ack 2817, win 170, options [nop,nop,TS val 1082912217 ecr 1933236870], length 0
23:56:32.817603 IP (tos 0x0, ttl 64, id 44788, offset 0, flags [DF], proto TCP (6), length 80)
    netapp-master9.bkp.bf1.yahoo.com.42181 > node03.hff01.bf1.yahoo.com.ndmp: Flags [P.], cksum 0xb478 (incorrect -> 0x7bde), seq 700:728, ack 2601, win 148, options [nop,nop,TS val 1082916404 ecr 3337898212], length 28
23:56:32.818289 IP (tos 0x0, ttl 64, id 44789, offset 0, flags [DF], proto TCP (6), length 52)
    netapp-master9.bkp.bf1.yahoo.com.42181 > node03.hff01.bf1.yahoo.com.ndmp: Flags [.], cksum 0x8ed5 (correct), ack 2705, win 148, options [nop,nop,TS val 1082916405 ecr 3337903218], length 0
23:56:33.636091 IP (tos 0x0, ttl 64, id 60437, offset 0, flags [DF], proto TCP (6), length 80)
    netapp-master9.bkp.bf1.yahoo.com.35558 > node03.hff01.bf1.yahoo.com.ndmp: Flags [P.], cksum 0xb478 (incorrect -> 0x561e), seq 728:756, ack 2817, win 170, options [nop,nop,TS val 1082917222 ecr 1933236870], length 28
23:56:33.637328 IP (tos 0x0, ttl 64, id 60438, offset 0, flags [DF], proto TCP (6), length 52)
    netapp-master9.bkp.bf1.yahoo.com.35558 > node03.hff01.bf1.yahoo.com.ndmp: Flags [.], cksum 0x691a (correct), ack 2921, win 170, options [nop,nop,TS val 1082917224 ecr 1933241876], length 0
23:56:37.823341 IP (tos 0x0, ttl 64, id 44790, offset 0, flags [DF], proto TCP (6), length 80)
    netapp-master9.bkp.bf1.yahoo.com.42181 > node03.hff01.bf1.yahoo.com.ndmp: Flags [P.], cksum 0xb478 (incorrect -> 0x5438), seq 728:756, ack 2705, win 148, options [nop,nop,TS val 1082921410 ecr 3337903218], length 28
23:56:37.823883 IP (tos 0x0, ttl 64, id 44791, offset 0, flags [DF], proto TCP (6), length 52)
    netapp-master9.bkp.bf1.yahoo.com.42181 > node03.hff01.bf1.yahoo.com.ndmp: Flags [.], cksum 0x6736 (correct), ack 2809, win 148, options [nop,nop,TS val 1082921410 ecr 3337908224], length 0
23:56:38.642905 IP (tos 0x0, ttl 64, id 60439, offset 0, flags [DF], proto TCP (6), length 80)
    netapp-master9.bkp.bf1.yahoo.com.35558 > node03.hff01.bf1.yahoo.com.ndmp: Flags [P.], cksum 0xb478 (incorrect -> 0x2e77), seq 756:784, ack 2921, win 170, options [nop,nop,TS val 1082922229 ecr 1933241876], length 28
23:56:38.643430 IP (tos 0x0, ttl 64, id 60440, offset 0, flags [DF], proto TCP (6), length 52)
    netapp-master9.bkp.bf1.yahoo.com.35558 > node03.hff01.bf1.yahoo.com.ndmp: Flags [.], cksum 0x417a (correct), ack 3025, win 170, options [nop,nop,TS val 1082922230 ecr 1933246882], length 0
23:56:42.829379 IP (tos 0x0, ttl 64, id 44792, offset 0, flags [DF], proto TCP (6), length 80)
    netapp-master9.bkp.bf1.yahoo.com.42181 > node03.hff01.bf1.yahoo.com.ndmp: Flags [P.], cksum 0xb478 (incorrect -> 0x2c92), seq 756:784, ack 2809, win 148, options [nop,nop,TS val 1082926416 ecr 3337908224], length 28
23:56:42.829883 IP (tos 0x0, ttl 64, id 44793, offset 0, flags [DF], proto TCP (6), length 52)
    netapp-master9.bkp.bf1.yahoo.com.42181 > node03.hff01.bf1.yahoo.com.ndmp: Flags [.], cksum 0x3f96 (correct), ack 2913, win 148, options [nop,nop,TS val 1082926416 ecr 3337913230], length 0
23:56:43.649013 IP (tos 0x0, ttl 64, id 60441, offset 0, flags [DF], proto TCP (6), length 80)
    netapp-master9.bkp.bf1.yahoo.com.35558 > node03.hff01.bf1.yahoo.com.ndmp: Flags [P.], cksum 0xb478 (incorrect -> 0x06d1), seq 784:812, ack 3025, win 170, options [nop,nop,TS val 1082927235 ecr 1933246882], length 28
23:56:43.649587 IP (tos 0x0, ttl 64, id 60442, offset 0, flags [DF], proto TCP (6), length 52)
    netapp-master9.bkp.bf1.yahoo.com.35558 > node03.hff01.bf1.yahoo.com.ndmp: Flags [.], cksum 0x19d9 (correct), ack 3129, win 170, options [nop,nop,TS val 1082927236 ecr 1933251889], length 0
23:56:47.835454 IP (tos 0x0, ttl 64, id 44794, offset 0, flags [DF], proto TCP (6), length 80)
    netapp-master9.bkp.bf1.yahoo.com.42181 > node03.hff01.bf1.yahoo.com.ndmp: Flags [P.], cksum 0xb478 (incorrect -> 0x04ec), seq 784:812, ack 2913, win 148, options [nop,nop,TS val 1082931422 ecr 3337913230], length 28
23:56:47.835983 IP (tos 0x0, ttl 64, id 44795, offset 0, flags [DF], proto TCP (6), length 52)
    netapp-master9.bkp.bf1.yahoo.com.42181 > node03.hff01.bf1.yahoo.com.ndmp: Flags [.], cksum 0x17f6 (correct), ack 3017, win 148, options [nop,nop,TS val 1082931422 ecr 3337918236], length 0
23:56:48.655205 IP (tos 0x0, ttl 64, id 60443, offset 0, flags [DF], proto TCP (6), length 80)
    netapp-master9.bkp.bf1.yahoo.com.35558 > node03.hff01.bf1.yahoo.com.ndmp: Flags [P.], cksum 0xb478 (incorrect -> 0xdf29), seq 812:840, ack 3129, win 170, options [nop,nop,TS val 1082932241 ecr 1933251889], length 28
23:56:48.656083 IP (tos 0x0, ttl 64, id 60444, offset 0, flags [DF], proto TCP (6), length 52)
    netapp-master9.bkp.bf1.yahoo.com.35558 > node03.hff01.bf1.yahoo.com.ndmp: Flags [.], cksum 0xf238 (correct), ack 3233, win 170, options [nop,nop,TS val 1082932242 ecr 1933256895], length 0
23:56:52.841500 IP (tos 0x0, ttl 64, id 44796, offset 0, flags [DF], proto TCP (6), length 80)
    netapp-master9.bkp.bf1.yahoo.com.42181 > node03.hff01.bf1.yahoo.com.ndmp: Flags [P.], cksum 0xb478 (incorrect -> 0xdd45), seq 812:840, ack 3017, win 148, options [nop,nop,TS val 1082936428 ecr 3337918236], length 28
23:56:52.842261 IP (tos 0x0, ttl 64, id 44797, offset 0, flags [DF], proto TCP (6), length 52)
    netapp-master9.bkp.bf1.yahoo.com.42181 > node03.hff01.bf1.yahoo.com.ndmp: Flags [.], cksum 0xf054 (correct), ack 3121, win 148, options [nop,nop,TS val 1082936429 ecr 3337923242], length 0
23:56:53.661673 IP (tos 0x0, ttl 64, id 60445, offset 0, flags [DF], proto TCP (6), length 80)
    netapp-master9.bkp.bf1.yahoo.com.35558 > node03.hff01.bf1.yahoo.com.ndmp: Flags [P.], cksum 0xb478 (incorrect -> 0xb782), seq 840:868, ack 3233, win 170, options [nop,nop,TS val 1082937248 ecr 1933256895], length 28
23:56:53.662274 IP (tos 0x0, ttl 64, id 60446, offset 0, flags [DF], proto TCP (6), length 52)
    netapp-master9.bkp.bf1.yahoo.com.35558 > node03.hff01.bf1.yahoo.com.ndmp: Flags [.], cksum 0xca97 (correct), ack 3337, win 170, options [nop,nop,TS val 1082937249 ecr 1933261901], length 0
23:56:57.847795 IP (tos 0x0, ttl 64, id 44798, offset 0, flags [DF], proto TCP (6), length 80)
    netapp-master9.bkp.bf1.yahoo.com.42181 > node03.hff01.bf1.yahoo.com.ndmp: Flags [P.], cksum 0xb478 (incorrect -> 0xb59f), seq 840:868, ack 3121, win 148, options [nop,nop,TS val 1082941434 ecr 3337923242], length 28
23:56:57.848302 IP (tos 0x0, ttl 64, id 44799, offset 0, flags [DF], proto TCP (6), length 52)
    netapp-master9.bkp.bf1.yahoo.com.42181 > node03.hff01.bf1.yahoo.com.ndmp: Flags [.], cksum 0xc8b4 (correct), ack 3225, win 148, options [nop,nop,TS val 1082941435 ecr 3337928248], length 0
23:56:58.667928 IP (tos 0x0, ttl 64, id 60447, offset 0, flags [DF], proto TCP (6), length 80)
    netapp-master9.bkp.bf1.yahoo.com.35558 > node03.hff01.bf1.yahoo.com.ndmp: Flags [P.], cksum 0xb478 (incorrect -> 0x8fdc), seq 868:896, ack 3337, win 170, options [nop,nop,TS val 1082942254 ecr 1933261901], length 28
23:56:58.668427 IP (tos 0x0, ttl 64, id 60448, offset 0, flags [DF], proto TCP (6), length 52)
    netapp-master9.bkp.bf1.yahoo.com.35558 > node03.hff01.bf1.yahoo.com.ndmp: Flags [.], cksum 0xa2f7 (correct), ack 3441, win 170, options [nop,nop,TS val 1082942255 ecr 1933266907], length 0
23:57:02.000647 IP (tos 0x0, ttl 64, id 44800, offset 0, flags [DF], proto TCP (6), length 52)
    netapp-master9.bkp.bf1.yahoo.com.42181 > node03.hff01.bf1.yahoo.com.ndmp: Flags [.], cksum 0xa7d3 (correct), ack 3337, win 148, options [nop,nop,TS val 1082945587 ecr 3337932401], length 0
23:57:02.849051 IP (tos 0x0, ttl 64, id 44801, offset 0, flags [DF], proto TCP (6), length 80)
    netapp-master9.bkp.bf1.yahoo.com.42181 > node03.hff01.bf1.yahoo.com.ndmp: Flags [P.], cksum 0xb478 (incorrect -> 0x7d55), seq 868:896, ack 3337, win 148, options [nop,nop,TS val 1082946435 ecr 3337932401], length 28
23:57:02.849524 IP (tos 0x0, ttl 64, id 44802, offset 0, flags [DF], proto TCP (6), length 52)
    netapp-master9.bkp.bf1.yahoo.com.42181 > node03.hff01.bf1.yahoo.com.ndmp: Flags [.], cksum 0xa0ad (correct), ack 3441, win 148, options [nop,nop,TS val 1082946436 ecr 3337933250], length 0
23:57:03.674087 IP (tos 0x0, ttl 64, id 60449, offset 0, flags [DF], proto TCP (6), length 80)
    netapp-master9.bkp.bf1.yahoo.com.35558 > node03.hff01.bf1.yahoo.com.ndmp: Flags [P.], cksum 0xb478 (incorrect -> 0x6836), seq 896:924, ack 3441, win 170, options [nop,nop,TS val 1082947260 ecr 1933266907], length 28
23:57:03.674831 IP (tos 0x0, ttl 64, id 60450, offset 0, flags [DF], proto TCP (6), length 52)
    netapp-master9.bkp.bf1.yahoo.com.35558 > node03.hff01.bf1.yahoo.com.ndmp: Flags [.], cksum 0x7b56 (correct), ack 3545, win 170, options [nop,nop,TS val 1082947261 ecr 1933271914], length 0
23:57:07.855059 IP (tos 0x0, ttl 64, id 44803, offset 0, flags [DF], proto TCP (6), length 80)
    netapp-master9.bkp.bf1.yahoo.com.42181 > node03.hff01.bf1.yahoo.com.ndmp: Flags [P.], cksum 0xb478 (incorrect -> 0x65ec), seq 896:924, ack 3441, win 148, options [nop,nop,TS val 1082951441 ecr 3337933250], length 28
23:57:07.855582 IP (tos 0x0, ttl 64, id 44804, offset 0, flags [DF], proto TCP (6), length 52)
    netapp-master9.bkp.bf1.yahoo.com.42181 > node03.hff01.bf1.yahoo.com.ndmp: Flags [.], cksum 0x790d (correct), ack 3545, win 148, options [nop,nop,TS val 1082951442 ecr 3337938256], length 0
23:57:08.680377 IP (tos 0x0, ttl 64, id 60451, offset 0, flags [DF], proto TCP (6), length 80)
    netapp-master9.bkp.bf1.yahoo.com.35558 > node03.hff01.bf1.yahoo.com.ndmp: Flags [P.], cksum 0xb478 (incorrect -> 0x408e), seq 924:952, ack 3545, win 170, options [nop,nop,TS val 1082952267 ecr 1933271914], length 28
23:57:08.681152 IP (tos 0x0, ttl 64, id 60452, offset 0, flags [DF], proto TCP (6), length 52)
    netapp-master9.bkp.bf1.yahoo.com.35558 > node03.hff01.bf1.yahoo.com.ndmp: Flags [.], cksum 0x53b6 (correct), ack 3649, win 170, options [nop,nop,TS val 1082952267 ecr 1933276920], length 0
23:57:12.861110 IP (tos 0x0, ttl 64, id 44805, offset 0, flags [DF], proto TCP (6), length 80)
    netapp-master9.bkp.bf1.yahoo.com.42181 > node03.hff01.bf1.yahoo.com.ndmp: Flags [P.], cksum 0xb478 (incorrect -> 0x3e46), seq 924:952, ack 3545, win 148, options [nop,nop,TS val 1082956447 ecr 3337938256], length 28
23:57:12.861812 IP (tos 0x0, ttl 64, id 44806, offset 0, flags [DF], proto TCP (6), length 52)
    netapp-master9.bkp.bf1.yahoo.com.42181 > node03.hff01.bf1.yahoo.com.ndmp: Flags [.], cksum 0x516d (correct), ack 3649, win 148, options [nop,nop,TS val 1082956448 ecr 3337943262], length 0
23:57:13.686739 IP (tos 0x0, ttl 64, id 60453, offset 0, flags [DF], proto TCP (6), length 80)
    netapp-master9.bkp.bf1.yahoo.com.35558 > node03.hff01.bf1.yahoo.com.ndmp: Flags [P.], cksum 0xb478 (incorrect -> 0x18e8), seq 952:980, ack 3649, win 170, options [nop,nop,TS val 1082957273 ecr 1933276920], length 28
23:57:13.687278 IP (tos 0x0, ttl 64, id 60454, offset 0, flags [DF], proto TCP (6), length 52)
    netapp-master9.bkp.bf1.yahoo.com.35558 > node03.hff01.bf1.yahoo.com.ndmp: Flags [.], cksum 0x2c15 (correct), ack 3753, win 170, options [nop,nop,TS val 1082957274 ecr 1933281926], length 0
23:57:17.867332 IP (tos 0x0, ttl 64, id 44807, offset 0, flags [DF], proto TCP (6), length 80)
    netapp-master9.bkp.bf1.yahoo.com.42181 > node03.hff01.bf1.yahoo.com.ndmp: Flags [P.], cksum 0xb478 (incorrect -> 0x169f), seq 952:980, ack 3649, win 148, options [nop,nop,TS val 1082961454 ecr 3337943262], length 28
23:57:17.867763 IP (tos 0x0, ttl 64, id 44808, offset 0, flags [DF], proto TCP (6), length 52)
    netapp-master9.bkp.bf1.yahoo.com.42181 > node03.hff01.bf1.yahoo.com.ndmp: Flags [.], cksum 0x29ce (correct), ack 3753, win 148, options [nop,nop,TS val 1082961454 ecr 3337948267], length 0
23:57:18.692845 IP (tos 0x0, ttl 64, id 60455, offset 0, flags [DF], proto TCP (6), length 80)
    netapp-master9.bkp.bf1.yahoo.com.35558 > node03.hff01.bf1.yahoo.com.ndmp: Flags [P.], cksum 0xb478 (incorrect -> 0xf141), seq 980:1008, ack 3753, win 170, options [nop,nop,TS val 1082962279 ecr 1933281926], length 28
23:57:18.693406 IP (tos 0x0, ttl 64, id 60456, offset 0, flags [DF], proto TCP (6), length 52)
    netapp-master9.bkp.bf1.yahoo.com.35558 > node03.hff01.bf1.yahoo.com.ndmp: Flags [.], cksum 0x0475 (correct), ack 3857, win 170, options [nop,nop,TS val 1082962280 ecr 1933286932], length 0
23:57:22.873261 IP (tos 0x0, ttl 64, id 44809, offset 0, flags [DF], proto TCP (6), length 80)
    netapp-master9.bkp.bf1.yahoo.com.42181 > node03.hff01.bf1.yahoo.com.ndmp: Flags [P.], cksum 0xb478 (incorrect -> 0xeefa), seq 980:1008, ack 3753, win 148, options [nop,nop,TS val 1082966459 ecr 3337948267], length 28
23:57:22.873725 IP (tos 0x0, ttl 64, id 44810, offset 0, flags [DF], proto TCP (6), length 52)
    netapp-master9.bkp.bf1.yahoo.com.42181 > node03.hff01.bf1.yahoo.com.ndmp: Flags [.], cksum 0x022d (correct), ack 3857, win 148, options [nop,nop,TS val 1082966460 ecr 3337953274], length 0
23:57:23.698880 IP (tos 0x0, ttl 64, id 60457, offset 0, flags [DF], proto TCP (6), length 80)
    netapp-master9.bkp.bf1.yahoo.com.35558 > node03.hff01.bf1.yahoo.com.ndmp: Flags [P.], cksum 0xb478 (incorrect -> 0xc99b), seq 1008:1036, ack 3857, win 170, options [nop,nop,TS val 1082967285 ecr 1933286932], length 28
23:57:23.699356 IP (tos 0x0, ttl 64, id 60458, offset 0, flags [DF], proto TCP (6), length 52)
    netapp-master9.bkp.bf1.yahoo.com.35558 > node03.hff01.bf1.yahoo.com.ndmp: Flags [.], cksum 0xdcd3 (correct), ack 3961, win 170, options [nop,nop,TS val 1082967286 ecr 1933291939], length 0
23:57:27.879219 IP (tos 0x0, ttl 64, id 44811, offset 0, flags [DF], proto TCP (6), length 80)
    netapp-master9.bkp.bf1.yahoo.com.42181 > node03.hff01.bf1.yahoo.com.ndmp: Flags [P.], cksum 0xb478 (incorrect -> 0xc753), seq 1008:1036, ack 3857, win 148, options [nop,nop,TS val 1082971465 ecr 3337953274], length 28
23:57:27.879815 IP (tos 0x0, ttl 64, id 44812, offset 0, flags [DF], proto TCP (6), length 52)
    netapp-master9.bkp.bf1.yahoo.com.42181 > node03.hff01.bf1.yahoo.com.ndmp: Flags [.], cksum 0xda8c (correct), ack 3961, win 148, options [nop,nop,TS val 1082971466 ecr 3337958280], length 0
23:57:28.704875 IP (tos 0x0, ttl 64, id 60459, offset 0, flags [DF], proto TCP (6), length 80)
    netapp-master9.bkp.bf1.yahoo.com.35558 > node03.hff01.bf1.yahoo.com.ndmp: Flags [P.], cksum 0xb478 (incorrect -> 0xa1f4), seq 1036:1064, ack 3961, win 170, options [nop,nop,TS val 1082972291 ecr 1933291939], length 28
23:57:28.705650 IP (tos 0x0, ttl 64, id 60460, offset 0, flags [DF], proto TCP (6), length 52)
    netapp-master9.bkp.bf1.yahoo.com.35558 > node03.hff01.bf1.yahoo.com.ndmp: Flags [.], cksum 0xb533 (correct), ack 4065, win 170, options [nop,nop,TS val 1082972292 ecr 1933296945], length 0
23:57:32.885378 IP (tos 0x0, ttl 64, id 44813, offset 0, flags [DF], proto TCP (6), length 80)
    netapp-master9.bkp.bf1.yahoo.com.42181 > node03.hff01.bf1.yahoo.com.ndmp: Flags [P.], cksum 0xb478 (incorrect -> 0x9fac), seq 1036:1064, ack 3961, win 148, options [nop,nop,TS val 1082976472 ecr 3337958280], length 28
23:57:32.886479 IP (tos 0x0, ttl 64, id 44814, offset 0, flags [DF], proto TCP (6), length 52)
    netapp-master9.bkp.bf1.yahoo.com.42181 > node03.hff01.bf1.yahoo.com.ndmp: Flags [.], cksum 0xb2eb (correct), ack 4065, win 148, options [nop,nop,TS val 1082976473 ecr 3337963286], length 0
23:57:33.711301 IP (tos 0x0, ttl 64, id 60461, offset 0, flags [DF], proto TCP (6), length 80)
    netapp-master9.bkp.bf1.yahoo.com.35558 > node03.hff01.bf1.yahoo.com.ndmp: Flags [P.], cksum 0xb478 (incorrect -> 0x7a4d), seq 1064:1092, ack 4065, win 170, options [nop,nop,TS val 1082977298 ecr 1933296945], length 28
23:57:33.711861 IP (tos 0x0, ttl 64, id 60462, offset 0, flags [DF], proto TCP (6), length 52)
    netapp-master9.bkp.bf1.yahoo.com.35558 > node03.hff01.bf1.yahoo.com.ndmp: Flags [.], cksum 0x8d93 (correct), ack 4169, win 170, options [nop,nop,TS val 1082977298 ecr 1933301951], length 0
23:57:37.892038 IP (tos 0x0, ttl 64, id 44815, offset 0, flags [DF], proto TCP (6), length 80)
    netapp-master9.bkp.bf1.yahoo.com.42181 > node03.hff01.bf1.yahoo.com.ndmp: Flags [P.], cksum 0xb478 (incorrect -> 0x7806), seq 1064:1092, ack 4065, win 148, options [nop,nop,TS val 1082981478 ecr 3337963286], length 28
23:57:37.892522 IP (tos 0x0, ttl 64, id 44816, offset 0, flags [DF], proto TCP (6), length 52)
    netapp-master9.bkp.bf1.yahoo.com.42181 > node03.hff01.bf1.yahoo.com.ndmp: Flags [.], cksum 0x8b4b (correct), ack 4169, win 148, options [nop,nop,TS val 1082981479 ecr 3337968292], length 0
23:57:38.717420 IP (tos 0x0, ttl 64, id 60463, offset 0, flags [DF], proto TCP (6), length 80)
    netapp-master9.bkp.bf1.yahoo.com.35558 > node03.hff01.bf1.yahoo.com.ndmp: Flags [P.], cksum 0xb478 (incorrect -> 0x52a7), seq 1092:1120, ack 4169, win 170, options [nop,nop,TS val 1082982304 ecr 1933301951], length 28
23:57:38.717993 IP (tos 0x0, ttl 64, id 60464, offset 0, flags [DF], proto TCP (6), length 52)
    netapp-master9.bkp.bf1.yahoo.com.35558 > node03.hff01.bf1.yahoo.com.ndmp: Flags [.], cksum 0x65f3 (correct), ack 4273, win 170, options [nop,nop,TS val 1082982304 ecr 1933306957], length 0
23:57:42.898080 IP (tos 0x0, ttl 64, id 44817, offset 0, flags [DF], proto TCP (6), length 80)
    netapp-master9.bkp.bf1.yahoo.com.42181 > node03.hff01.bf1.yahoo.com.ndmp: Flags [P.], cksum 0xb478 (incorrect -> 0x5060), seq 1092:1120, ack 4169, win 148, options [nop,nop,TS val 1082986484 ecr 3337968292], length 28
23:57:42.898657 IP (tos 0x0, ttl 64, id 44818, offset 0, flags [DF], proto TCP (6), length 52)
    netapp-master9.bkp.bf1.yahoo.com.42181 > node03.hff01.bf1.yahoo.com.ndmp: Flags [.], cksum 0x63aa (correct), ack 4273, win 148, options [nop,nop,TS val 1082986485 ecr 3337973299], length 0
23:57:43.718706 IP (tos 0x0, ttl 64, id 60465, offset 0, flags [DF], proto TCP (6), length 80)
    netapp-master9.bkp.bf1.yahoo.com.35558 > node03.hff01.bf1.yahoo.com.ndmp: Flags [P.], cksum 0xb478 (incorrect -> 0x2b06), seq 1120:1148, ack 4273, win 170, options [nop,nop,TS val 1082987305 ecr 1933306957], length 28
23:57:43.719270 IP (tos 0x0, ttl 64, id 60466, offset 0, flags [DF], proto TCP (6), length 52)
    netapp-master9.bkp.bf1.yahoo.com.35558 > node03.hff01.bf1.yahoo.com.ndmp: Flags [.], cksum 0x3e5b (correct), ack 4377, win 170, options [nop,nop,TS val 1082987306 ecr 1933311959], length 0
23:57:47.904221 IP (tos 0x0, ttl 64, id 44819, offset 0, flags [DF], proto TCP (6), length 80)
    netapp-master9.bkp.bf1.yahoo.com.42181 > node03.hff01.bf1.yahoo.com.ndmp: Flags [P.], cksum 0xb478 (incorrect -> 0x28b9), seq 1120:1148, ack 4273, win 148, options [nop,nop,TS val 1082991490 ecr 3337973299], length 28
23:57:47.904764 IP (tos 0x0, ttl 64, id 44820, offset 0, flags [DF], proto TCP (6), length 52)
    netapp-master9.bkp.bf1.yahoo.com.42181 > node03.hff01.bf1.yahoo.com.ndmp: Flags [.], cksum 0x3c0a (correct), ack 4377, win 148, options [nop,nop,TS val 1082991491 ecr 3337978305], length 0
23:57:48.724935 IP (tos 0x0, ttl 64, id 60467, offset 0, flags [DF], proto TCP (6), length 80)
    netapp-master9.bkp.bf1.yahoo.com.35558 > node03.hff01.bf1.yahoo.com.ndmp: Flags [P.], cksum 0xb478 (incorrect -> 0x0364), seq 1148:1176, ack 4377, win 170, options [nop,nop,TS val 1082992311 ecr 1933311959], length 28
23:57:48.725668 IP (tos 0x0, ttl 64, id 60468, offset 0, flags [DF], proto TCP (6), length 52)
    netapp-master9.bkp.bf1.yahoo.com.35558 > node03.hff01.bf1.yahoo.com.ndmp: Flags [.], cksum 0x16bb (correct), ack 4481, win 170, options [nop,nop,TS val 1082992312 ecr 1933316965], length 0
23:57:52.910316 IP (tos 0x0, ttl 64, id 44821, offset 0, flags [DF], proto TCP (6), length 80)
    netapp-master9.bkp.bf1.yahoo.com.42181 > node03.hff01.bf1.yahoo.com.ndmp: Flags [P.], cksum 0xb478 (incorrect -> 0x0112), seq 1148:1176, ack 4377, win 148, options [nop,nop,TS val 1082996497 ecr 3337978305], length 28
23:57:52.910995 IP (tos 0x0, ttl 64, id 44822, offset 0, flags [DF], proto TCP (6), length 52)
    netapp-master9.bkp.bf1.yahoo.com.42181 > node03.hff01.bf1.yahoo.com.ndmp: Flags [.], cksum 0x146a (correct), ack 4481, win 148, options [nop,nop,TS val 1082996497 ecr 3337983311], length 0
23:57:53.731335 IP (tos 0x0, ttl 64, id 60469, offset 0, flags [DF], proto TCP (6), length 80)
    netapp-master9.bkp.bf1.yahoo.com.35558 > node03.hff01.bf1.yahoo.com.ndmp: Flags [P.], cksum 0xb478 (incorrect -> 0xdbbc), seq 1176:1204, ack 4481, win 170, options [nop,nop,TS val 1082997318 ecr 1933316965], length 28
23:57:53.731873 IP (tos 0x0, ttl 64, id 60470, offset 0, flags [DF], proto TCP (6), length 52)
    netapp-master9.bkp.bf1.yahoo.com.35558 > node03.hff01.bf1.yahoo.com.ndmp: Flags [.], cksum 0xef1a (correct), ack 4585, win 170, options [nop,nop,TS val 1082997318 ecr 1933321971], length 0
23:57:57.916474 IP (tos 0x0, ttl 64, id 44823, offset 0, flags [DF], proto TCP (6), length 80)
    netapp-master9.bkp.bf1.yahoo.com.42181 > node03.hff01.bf1.yahoo.com.ndmp: Flags [P.], cksum 0xb478 (incorrect -> 0xd96b), seq 1176:1204, ack 4481, win 148, options [nop,nop,TS val 1083001503 ecr 3337983311], length 28
23:57:57.916981 IP (tos 0x0, ttl 64, id 44824, offset 0, flags [DF], proto TCP (6), length 52)
    netapp-master9.bkp.bf1.yahoo.com.42181 > node03.hff01.bf1.yahoo.com.ndmp: Flags [.], cksum 0xecc9 (correct), ack 4585, win 148, options [nop,nop,TS val 1083001503 ecr 3337988317], length 0
23:57:58.737430 IP (tos 0x0, ttl 64, id 60471, offset 0, flags [DF], proto TCP (6), length 80)
    netapp-master9.bkp.bf1.yahoo.com.35558 > node03.hff01.bf1.yahoo.com.ndmp: Flags [P.], cksum 0xb478 (incorrect -> 0xb416), seq 1204:1232, ack 4585, win 170, options [nop,nop,TS val 1083002324 ecr 1933321971], length 28
23:57:58.737956 IP (tos 0x0, ttl 64, id 60472, offset 0, flags [DF], proto TCP (6), length 52)
    netapp-master9.bkp.bf1.yahoo.com.35558 > node03.hff01.bf1.yahoo.com.ndmp: Flags [.], cksum 0xc77b (correct), ack 4689, win 170, options [nop,nop,TS val 1083002324 ecr 1933326976], length 0
23:58:02.922510 IP (tos 0x0, ttl 64, id 44825, offset 0, flags [DF], proto TCP (6), length 80)
    netapp-master9.bkp.bf1.yahoo.com.42181 > node03.hff01.bf1.yahoo.com.ndmp: Flags [P.], cksum 0xb478 (incorrect -> 0xb1c5), seq 1204:1232, ack 4585, win 148, options [nop,nop,TS val 1083006509 ecr 3337988317], length 28
23:58:02.923070 IP (tos 0x0, ttl 64, id 44826, offset 0, flags [DF], proto TCP (6), length 52)
    netapp-master9.bkp.bf1.yahoo.com.42181 > node03.hff01.bf1.yahoo.com.ndmp: Flags [.], cksum 0xc529 (correct), ack 4689, win 148, options [nop,nop,TS val 1083006509 ecr 3337993323], length 0
23:58:03.743409 IP (tos 0x0, ttl 64, id 60473, offset 0, flags [DF], proto TCP (6), length 80)
    netapp-master9.bkp.bf1.yahoo.com.35558 > node03.hff01.bf1.yahoo.com.ndmp: Flags [P.], cksum 0xb478 (incorrect -> 0x8c71), seq 1232:1260, ack 4689, win 170, options [nop,nop,TS val 1083007330 ecr 1933326976], length 28
23:58:03.743920 IP (tos 0x0, ttl 64, id 60474, offset 0, flags [DF], proto TCP (6), length 52)
    netapp-master9.bkp.bf1.yahoo.com.35558 > node03.hff01.bf1.yahoo.com.ndmp: Flags [.], cksum 0x9fda (correct), ack 4793, win 170, options [nop,nop,TS val 1083007330 ecr 1933331983], length 0
23:58:07.928690 IP (tos 0x0, ttl 64, id 44827, offset 0, flags [DF], proto TCP (6), length 80)
    netapp-master9.bkp.bf1.yahoo.com.42181 > node03.hff01.bf1.yahoo.com.ndmp: Flags [P.], cksum 0xb478 (incorrect -> 0x8a1f), seq 1232:1260, ack 4689, win 148, options [nop,nop,TS val 1083011515 ecr 3337993323], length 28
23:58:07.931245 IP (tos 0x0, ttl 64, id 44828, offset 0, flags [DF], proto TCP (6), length 52)
    netapp-master9.bkp.bf1.yahoo.com.42181 > node03.hff01.bf1.yahoo.com.ndmp: Flags [.], cksum 0x9d85 (correct), ack 4793, win 148, options [nop,nop,TS val 1083011517 ecr 3337998331], length 0
23:58:08.749490 IP (tos 0x0, ttl 64, id 60475, offset 0, flags [DF], proto TCP (6), length 80)
    netapp-master9.bkp.bf1.yahoo.com.35558 > node03.hff01.bf1.yahoo.com.ndmp: Flags [P.], cksum 0xb478 (incorrect -> 0x64ca), seq 1260:1288, ack 4793, win 170, options [nop,nop,TS val 1083012336 ecr 1933331983], length 28
23:58:08.750339 IP (tos 0x0, ttl 64, id 60476, offset 0, flags [DF], proto TCP (6), length 52)
    netapp-master9.bkp.bf1.yahoo.com.35558 > node03.hff01.bf1.yahoo.com.ndmp: Flags [.], cksum 0x7839 (correct), ack 4897, win 170, options [nop,nop,TS val 1083012337 ecr 1933336989], length 0
23:58:12.936858 IP (tos 0x0, ttl 64, id 44829, offset 0, flags [DF], proto TCP (6), length 80)
    netapp-master9.bkp.bf1.yahoo.com.42181 > node03.hff01.bf1.yahoo.com.ndmp: Flags [P.], cksum 0xb478 (incorrect -> 0x6275), seq 1260:1288, ack 4793, win 148, options [nop,nop,TS val 1083016523 ecr 3337998331], length 28
23:58:12.937851 IP (tos 0x0, ttl 64, id 44830, offset 0, flags [DF], proto TCP (6), length 52)
    netapp-master9.bkp.bf1.yahoo.com.42181 > node03.hff01.bf1.yahoo.com.ndmp: Flags [.], cksum 0x75e3 (correct), ack 4897, win 148, options [nop,nop,TS val 1083016524 ecr 3338003338], length 0
23:58:13.755909 IP (tos 0x0, ttl 64, id 60477, offset 0, flags [DF], proto TCP (6), length 80)
    netapp-master9.bkp.bf1.yahoo.com.35558 > node03.hff01.bf1.yahoo.com.ndmp: Flags [P.], cksum 0xb478 (incorrect -> 0x3d24), seq 1288:1316, ack 4897, win 170, options [nop,nop,TS val 1083017342 ecr 1933336989], length 28
23:58:13.756523 IP (tos 0x0, ttl 64, id 60478, offset 0, flags [DF], proto TCP (6), length 52)
    netapp-master9.bkp.bf1.yahoo.com.35558 > node03.hff01.bf1.yahoo.com.ndmp: Flags [.], cksum 0x5099 (correct), ack 5001, win 170, options [nop,nop,TS val 1083017343 ecr 1933341995], length 0
23:58:17.943381 IP (tos 0x0, ttl 64, id 44831, offset 0, flags [DF], proto TCP (6), length 80)
    netapp-master9.bkp.bf1.yahoo.com.42181 > node03.hff01.bf1.yahoo.com.ndmp: Flags [P.], cksum 0xb478 (incorrect -> 0x3acd), seq 1288:1316, ack 4897, win 148, options [nop,nop,TS val 1083021530 ecr 3338003338], length 28
23:58:17.943868 IP (tos 0x0, ttl 64, id 44832, offset 0, flags [DF], proto TCP (6), length 52)
    netapp-master9.bkp.bf1.yahoo.com.42181 > node03.hff01.bf1.yahoo.com.ndmp: Flags [.], cksum 0x4e44 (correct), ack 5001, win 148, options [nop,nop,TS val 1083021530 ecr 3338008343], length 0
23:58:18.761337 IP (tos 0x0, ttl 64, id 60479, offset 0, flags [DF], proto TCP (6), length 80)
    netapp-master9.bkp.bf1.yahoo.com.35558 > node03.hff01.bf1.yahoo.com.ndmp: Flags [P.], cksum 0xb478 (incorrect -> 0x157f), seq 1316:1344, ack 5001, win 170, options [nop,nop,TS val 1083022347 ecr 1933341995], length 28
23:58:18.768982 IP (tos 0x0, ttl 64, id 60480, offset 0, flags [DF], proto TCP (6), length 52)
    netapp-master9.bkp.bf1.yahoo.com.35558 > node03.hff01.bf1.yahoo.com.ndmp: Flags [.], cksum 0x28ef (correct), ack 5105, win 170, options [nop,nop,TS val 1083022355 ecr 1933347005], length 0
23:58:22.948404 IP (tos 0x0, ttl 64, id 44833, offset 0, flags [DF], proto TCP (6), length 80)
    netapp-master9.bkp.bf1.yahoo.com.42181 > node03.hff01.bf1.yahoo.com.ndmp: Flags [P.], cksum 0xb478 (incorrect -> 0x1329), seq 1316:1344, ack 5001, win 148, options [nop,nop,TS val 1083026535 ecr 3338008343], length 28
23:58:22.948911 IP (tos 0x0, ttl 64, id 44834, offset 0, flags [DF], proto TCP (6), length 52)
    netapp-master9.bkp.bf1.yahoo.com.42181 > node03.hff01.bf1.yahoo.com.ndmp: Flags [.], cksum 0x26a5 (correct), ack 5105, win 148, options [nop,nop,TS val 1083026535 ecr 3338013349], length 0
23:58:23.774418 IP (tos 0x0, ttl 64, id 60481, offset 0, flags [DF], proto TCP (6), length 80)
    netapp-master9.bkp.bf1.yahoo.com.35558 > node03.hff01.bf1.yahoo.com.ndmp: Flags [P.], cksum 0xb478 (incorrect -> 0xedcc), seq 1344:1372, ack 5105, win 170, options [nop,nop,TS val 1083027361 ecr 1933347005], length 28
23:58:23.774945 IP (tos 0x0, ttl 64, id 60482, offset 0, flags [DF], proto TCP (6), length 52)
    netapp-master9.bkp.bf1.yahoo.com.35558 > node03.hff01.bf1.yahoo.com.ndmp: Flags [.], cksum 0x014c (correct), ack 5209, win 170, options [nop,nop,TS val 1083027361 ecr 1933352014], length 0
23:58:27.954449 IP (tos 0x0, ttl 64, id 44835, offset 0, flags [DF], proto TCP (6), length 80)
    netapp-master9.bkp.bf1.yahoo.com.42181 > node03.hff01.bf1.yahoo.com.ndmp: Flags [P.], cksum 0xb478 (incorrect -> 0xeb82), seq 1344:1372, ack 5105, win 148, options [nop,nop,TS val 1083031541 ecr 3338013349], length 28
23:58:27.954998 IP (tos 0x0, ttl 64, id 44836, offset 0, flags [DF], proto TCP (6), length 52)
    netapp-master9.bkp.bf1.yahoo.com.42181 > node03.hff01.bf1.yahoo.com.ndmp: Flags [.], cksum 0xff04 (correct), ack 5209, win 148, options [nop,nop,TS val 1083031541 ecr 3338018355], length 0
23:58:28.780525 IP (tos 0x0, ttl 64, id 60483, offset 0, flags [DF], proto TCP (6), length 80)
    netapp-master9.bkp.bf1.yahoo.com.35558 > node03.hff01.bf1.yahoo.com.ndmp: Flags [P.], cksum 0xb478 (incorrect -> 0xc623), seq 1372:1400, ack 5209, win 170, options [nop,nop,TS val 1083032367 ecr 1933352014], length 28
23:58:28.781401 IP (tos 0x0, ttl 64, id 60484, offset 0, flags [DF], proto TCP (6), length 52)
    netapp-master9.bkp.bf1.yahoo.com.35558 > node03.hff01.bf1.yahoo.com.ndmp: Flags [.], cksum 0xd9aa (correct), ack 5313, win 170, options [nop,nop,TS val 1083032368 ecr 1933357020], length 0
23:58:32.960577 IP (tos 0x0, ttl 64, id 44837, offset 0, flags [DF], proto TCP (6), length 80)
    netapp-master9.bkp.bf1.yahoo.com.42181 > node03.hff01.bf1.yahoo.com.ndmp: Flags [P.], cksum 0xb478 (incorrect -> 0xc3dc), seq 1372:1400, ack 5209, win 148, options [nop,nop,TS val 1083036547 ecr 3338018355], length 28
23:58:32.961293 IP (tos 0x0, ttl 64, id 44838, offset 0, flags [DF], proto TCP (6), length 52)
    netapp-master9.bkp.bf1.yahoo.com.42181 > node03.hff01.bf1.yahoo.com.ndmp: Flags [.], cksum 0xd763 (correct), ack 5313, win 148, options [nop,nop,TS val 1083036548 ecr 3338023361], length 0
23:58:33.786404 IP (tos 0x0, ttl 64, id 60485, offset 0, flags [DF], proto TCP (6), length 80)
    netapp-master9.bkp.bf1.yahoo.com.35558 > node03.hff01.bf1.yahoo.com.ndmp: Flags [P.], cksum 0xb478 (incorrect -> 0x9e7d), seq 1400:1428, ack 5313, win 170, options [nop,nop,TS val 1083037373 ecr 1933357020], length 28
23:58:33.786948 IP (tos 0x0, ttl 64, id 60486, offset 0, flags [DF], proto TCP (6), length 52)
    netapp-master9.bkp.bf1.yahoo.com.35558 > node03.hff01.bf1.yahoo.com.ndmp: Flags [.], cksum 0xb20b (correct), ack 5417, win 170, options [nop,nop,TS val 1083037373 ecr 1933362026], length 0
23:58:37.966880 IP (tos 0x0, ttl 64, id 44839, offset 0, flags [DF], proto TCP (6), length 80)
    netapp-master9.bkp.bf1.yahoo.com.42181 > node03.hff01.bf1.yahoo.com.ndmp: Flags [P.], cksum 0xb478 (incorrect -> 0x9c36), seq 1400:1428, ack 5313, win 148, options [nop,nop,TS val 1083041553 ecr 3338023361], length 28
23:58:37.967469 IP (tos 0x0, ttl 64, id 44840, offset 0, flags [DF], proto TCP (6), length 52)
    netapp-master9.bkp.bf1.yahoo.com.42181 > node03.hff01.bf1.yahoo.com.ndmp: Flags [.], cksum 0xafc3 (correct), ack 5417, win 148, options [nop,nop,TS val 1083041554 ecr 3338028367], length 0
23:58:38.792600 IP (tos 0x0, ttl 64, id 60487, offset 0, flags [DF], proto TCP (6), length 80)
    netapp-master9.bkp.bf1.yahoo.com.35558 > node03.hff01.bf1.yahoo.com.ndmp: Flags [P.], cksum 0xb478 (incorrect -> 0x76d7), seq 1428:1456, ack 5417, win 170, options [nop,nop,TS val 1083042379 ecr 1933362026], length 28
23:58:38.793165 IP (tos 0x0, ttl 64, id 60488, offset 0, flags [DF], proto TCP (6), length 52)
    netapp-master9.bkp.bf1.yahoo.com.35558 > node03.hff01.bf1.yahoo.com.ndmp: Flags [.], cksum 0x8a6a (correct), ack 5521, win 170, options [nop,nop,TS val 1083042379 ecr 1933367033], length 0
23:58:40.840229 IP (tos 0x0, ttl 64, id 51800, offset 0, flags [DF], proto TCP (6), length 100)
    netapp-master9.bkp.bf1.yahoo.com.51432 > node03.hff01.bf1.yahoo.com.ndmp: Flags [P.], cksum 0xb48c (incorrect -> 0x5920), seq 376:424, ack 1561, win 126, options [nop,nop,TS val 1083044426 ecr 3019228824], length 48
23:58:40.842570 IP (tos 0x0, ttl 64, id 51801, offset 0, flags [DF], proto TCP (6), length 52)
    netapp-master9.bkp.bf1.yahoo.com.51432 > node03.hff01.bf1.yahoo.com.ndmp: Flags [.], cksum 0x8a2a (correct), ack 1593, win 126, options [nop,nop,TS val 1083044429 ecr 3019478153], length 0
23:58:40.879616 IP (tos 0x0, ttl 64, id 51802, offset 0, flags [DF], proto TCP (6), length 300)
    netapp-master9.bkp.bf1.yahoo.com.51432 > node03.hff01.bf1.yahoo.com.ndmp: Flags [P.], cksum 0xb554 (incorrect -> 0xe3d8), seq 424:672, ack 1593, win 126, options [nop,nop,TS val 1083044466 ecr 3019478153], length 248
23:58:40.920265 IP (tos 0x0, ttl 64, id 51803, offset 0, flags [DF], proto TCP (6), length 52)
    netapp-master9.bkp.bf1.yahoo.com.51432 > node03.hff01.bf1.yahoo.com.ndmp: Flags [.], cksum 0x889e (correct), ack 1625, win 126, options [nop,nop,TS val 1083044507 ecr 3019478191], length 0
23:58:40.968380 IP (tos 0x0, ttl 64, id 51804, offset 0, flags [DF], proto TCP (6), length 52)
    netapp-master9.bkp.bf1.yahoo.com.51432 > node03.hff01.bf1.yahoo.com.ndmp: Flags [.], cksum 0x87be (correct), ack 1713, win 126, options [nop,nop,TS val 1083044555 ecr 3019478279], length 0
23:58:40.978460 IP (tos 0x0, ttl 64, id 51805, offset 0, flags [DF], proto TCP (6), length 52)
    netapp-master9.bkp.bf1.yahoo.com.51432 > node03.hff01.bf1.yahoo.com.ndmp: Flags [.], cksum 0x8717 (correct), ack 1849, win 137, options [nop,nop,TS val 1083044565 ecr 3019478289], length 0
23:58:41.205768 IP (tos 0x0, ttl 64, id 51806, offset 0, flags [DF], proto TCP (6), length 52)
    netapp-master9.bkp.bf1.yahoo.com.51432 > node03.hff01.bf1.yahoo.com.ndmp: Flags [.], cksum 0x8501 (correct), ack 1929, win 137, options [nop,nop,TS val 1083044792 ecr 3019478516], length 0
23:58:42.266655 IP (tos 0x0, ttl 64, id 51807, offset 0, flags [DF], proto TCP (6), length 52)
    netapp-master9.bkp.bf1.yahoo.com.51432 > node03.hff01.bf1.yahoo.com.ndmp: Flags [.], cksum 0x7c5e (correct), ack 2021, win 137, options [nop,nop,TS val 1083045853 ecr 3019479574], length 0
23:58:42.273593 IP (tos 0x0, ttl 64, id 51808, offset 0, flags [DF], proto TCP (6), length 52)
    netapp-master9.bkp.bf1.yahoo.com.51432 > node03.hff01.bf1.yahoo.com.ndmp: Flags [.], cksum 0x7bd9 (correct), ack 2137, win 137, options [nop,nop,TS val 1083045860 ecr 3019479584], length 0
23:58:42.273932 IP (tos 0x0, ttl 64, id 51809, offset 0, flags [DF], proto TCP (6), length 52)
    netapp-master9.bkp.bf1.yahoo.com.51432 > node03.hff01.bf1.yahoo.com.ndmp: Flags [.], cksum 0x7afe (correct), ack 2345, win 148, options [nop,nop,TS val 1083045860 ecr 3019479584], length 0
23:58:42.274287 IP (tos 0x0, ttl 64, id 51810, offset 0, flags [DF], proto TCP (6), length 52)
    netapp-master9.bkp.bf1.yahoo.com.51432 > node03.hff01.bf1.yahoo.com.ndmp: Flags [.], cksum 0x7aa5 (correct), ack 2433, win 148, options [nop,nop,TS val 1083045860 ecr 3019479585], length 0
23:58:42.351744 IP (tos 0x0, ttl 64, id 51811, offset 0, flags [DF], proto TCP (6), length 52)
    netapp-master9.bkp.bf1.yahoo.com.51432 > node03.hff01.bf1.yahoo.com.ndmp: Flags [.], cksum 0x797f (correct), ack 2561, win 159, options [nop,nop,TS val 1083045938 ecr 3019479662], length 0
23:58:42.358502 IP (tos 0x0, ttl 64, id 51812, offset 0, flags [DF], proto TCP (6), length 52)
    netapp-master9.bkp.bf1.yahoo.com.51432 > node03.hff01.bf1.yahoo.com.ndmp: Flags [.], cksum 0x7919 (correct), ack 2649, win 159, options [nop,nop,TS val 1083045945 ecr 3019479669], length 0
23:58:42.417508 IP (tos 0x0, ttl 64, id 51813, offset 0, flags [DF], proto TCP (6), length 52)
    netapp-master9.bkp.bf1.yahoo.com.51432 > node03.hff01.bf1.yahoo.com.ndmp: Flags [.], cksum 0x7857 (correct), ack 2725, win 159, options [nop,nop,TS val 1083046004 ecr 3019479728], length 0
23:58:42.417909 IP (tos 0x0, ttl 64, id 51814, offset 0, flags [DF], proto TCP (6), length 52)
    netapp-master9.bkp.bf1.yahoo.com.51432 > node03.hff01.bf1.yahoo.com.ndmp: Flags [.], cksum 0x77ff (correct), ack 2813, win 159, options [nop,nop,TS val 1083046004 ecr 3019479728], length 0
23:58:42.973055 IP (tos 0x0, ttl 64, id 44841, offset 0, flags [DF], proto TCP (6), length 80)
    netapp-master9.bkp.bf1.yahoo.com.42181 > node03.hff01.bf1.yahoo.com.ndmp: Flags [P.], cksum 0xb478 (incorrect -> 0x7490), seq 1428:1456, ack 5417, win 148, options [nop,nop,TS val 1083046559 ecr 3338028367], length 28
23:58:42.973644 IP (tos 0x0, ttl 64, id 44842, offset 0, flags [DF], proto TCP (6), length 52)
    netapp-master9.bkp.bf1.yahoo.com.42181 > node03.hff01.bf1.yahoo.com.ndmp: Flags [.], cksum 0x8822 (correct), ack 5521, win 148, options [nop,nop,TS val 1083046560 ecr 3338033374], length 0
23:58:43.798763 IP (tos 0x0, ttl 64, id 60489, offset 0, flags [DF], proto TCP (6), length 80)
    netapp-master9.bkp.bf1.yahoo.com.35558 > node03.hff01.bf1.yahoo.com.ndmp: Flags [P.], cksum 0xb478 (incorrect -> 0x4f30), seq 1456:1484, ack 5521, win 170, options [nop,nop,TS val 1083047385 ecr 1933367033], length 28
23:58:43.799354 IP (tos 0x0, ttl 64, id 60490, offset 0, flags [DF], proto TCP (6), length 52)
    netapp-master9.bkp.bf1.yahoo.com.35558 > node03.hff01.bf1.yahoo.com.ndmp: Flags [.], cksum 0x62c9 (correct), ack 5625, win 170, options [nop,nop,TS val 1083047386 ecr 1933372039], length 0
23:58:45.885282 IP (tos 0x0, ttl 64, id 51815, offset 0, flags [DF], proto TCP (6), length 80)
    netapp-master9.bkp.bf1.yahoo.com.51432 > node03.hff01.bf1.yahoo.com.ndmp: Flags [P.], cksum 0xb478 (incorrect -> 0x5360), seq 672:700, ack 2813, win 159, options [nop,nop,TS val 1083049472 ecr 3019479728], length 28
23:58:45.886056 IP (tos 0x0, ttl 64, id 51816, offset 0, flags [DF], proto TCP (6), length 52)
    netapp-master9.bkp.bf1.yahoo.com.51432 > node03.hff01.bf1.yahoo.com.ndmp: Flags [.], cksum 0x5c63 (correct), ack 2917, win 159, options [nop,nop,TS val 1083049472 ecr 3019483196], length 0
23:58:47.979173 IP (tos 0x0, ttl 64, id 44843, offset 0, flags [DF], proto TCP (6), length 80)
    netapp-master9.bkp.bf1.yahoo.com.42181 > node03.hff01.bf1.yahoo.com.ndmp: Flags [P.], cksum 0xb478 (incorrect -> 0x4ce9), seq 1456:1484, ack 5521, win 148, options [nop,nop,TS val 1083051565 ecr 3338033374], length 28
23:58:47.979791 IP (tos 0x0, ttl 64, id 44844, offset 0, flags [DF], proto TCP (6), length 52)
    netapp-master9.bkp.bf1.yahoo.com.42181 > node03.hff01.bf1.yahoo.com.ndmp: Flags [.], cksum 0x6082 (correct), ack 5625, win 148, options [nop,nop,TS val 1083051566 ecr 3338038380], length 0
23:58:48.804899 IP (tos 0x0, ttl 64, id 60491, offset 0, flags [DF], proto TCP (6), length 80)
    netapp-master9.bkp.bf1.yahoo.com.35558 > node03.hff01.bf1.yahoo.com.ndmp: Flags [P.], cksum 0xb478 (incorrect -> 0x278a), seq 1484:1512, ack 5625, win 170, options [nop,nop,TS val 1083052391 ecr 1933372039], length 28
23:58:48.805617 IP (tos 0x0, ttl 64, id 60492, offset 0, flags [DF], proto TCP (6), length 52)
    netapp-master9.bkp.bf1.yahoo.com.35558 > node03.hff01.bf1.yahoo.com.ndmp: Flags [.], cksum 0x3b29 (correct), ack 5729, win 170, options [nop,nop,TS val 1083052392 ecr 1933377045], length 0
23:58:50.891625 IP (tos 0x0, ttl 64, id 51817, offset 0, flags [DF], proto TCP (6), length 80)
    netapp-master9.bkp.bf1.yahoo.com.51432 > node03.hff01.bf1.yahoo.com.ndmp: Flags [P.], cksum 0xb478 (incorrect -> 0x31bc), seq 700:728, ack 2917, win 159, options [nop,nop,TS val 1083054478 ecr 3019483196], length 28
23:58:50.892175 IP (tos 0x0, ttl 64, id 51818, offset 0, flags [DF], proto TCP (6), length 52)
    netapp-master9.bkp.bf1.yahoo.com.51432 > node03.hff01.bf1.yahoo.com.ndmp: Flags [.], cksum 0x34c3 (correct), ack 3021, win 159, options [nop,nop,TS val 1083054478 ecr 3019488202], length 0
23:58:52.165214 IP (tos 0x0, ttl 64, id 51819, offset 0, flags [DF], proto TCP (6), length 52)
    netapp-master9.bkp.bf1.yahoo.com.51432 > node03.hff01.bf1.yahoo.com.ndmp: Flags [.], cksum 0x2a79 (correct), ack 3109, win 159, options [nop,nop,TS val 1083055751 ecr 3019489475], length 0
23:58:52.984392 IP (tos 0x0, ttl 64, id 44845, offset 0, flags [DF], proto TCP (6), length 80)
    netapp-master9.bkp.bf1.yahoo.com.42181 > node03.hff01.bf1.yahoo.com.ndmp: Flags [P.], cksum 0xb478 (incorrect -> 0x2543), seq 1484:1512, ack 5625, win 148, options [nop,nop,TS val 1083056571 ecr 3338038380], length 28
23:58:52.985220 IP (tos 0x0, ttl 64, id 44846, offset 0, flags [DF], proto TCP (6), length 52)
    netapp-master9.bkp.bf1.yahoo.com.42181 > node03.hff01.bf1.yahoo.com.ndmp: Flags [.], cksum 0x38e4 (correct), ack 5729, win 148, options [nop,nop,TS val 1083056571 ecr 3338043385], length 0
23:58:53.811230 IP (tos 0x0, ttl 64, id 60493, offset 0, flags [DF], proto TCP (6), length 80)
    netapp-master9.bkp.bf1.yahoo.com.35558 > node03.hff01.bf1.yahoo.com.ndmp: Flags [P.], cksum 0xb478 (incorrect -> 0xffe3), seq 1512:1540, ack 5729, win 170, options [nop,nop,TS val 1083057397 ecr 1933377045], length 28
23:58:53.811793 IP (tos 0x0, ttl 64, id 60494, offset 0, flags [DF], proto TCP (6), length 52)
    netapp-master9.bkp.bf1.yahoo.com.35558 > node03.hff01.bf1.yahoo.com.ndmp: Flags [.], cksum 0x138a (correct), ack 5833, win 170, options [nop,nop,TS val 1083057398 ecr 1933382050], length 0
23:58:55.896521 IP (tos 0x0, ttl 64, id 51820, offset 0, flags [DF], proto TCP (6), length 80)
    netapp-master9.bkp.bf1.yahoo.com.51432 > node03.hff01.bf1.yahoo.com.ndmp: Flags [P.], cksum 0xb478 (incorrect -> 0x04c6), seq 728:756, ack 3109, win 159, options [nop,nop,TS val 1083059483 ecr 3019489475], length 28
23:58:55.897374 IP (tos 0x0, ttl 64, id 51821, offset 0, flags [DF], proto TCP (6), length 52)
    netapp-master9.bkp.bf1.yahoo.com.51432 > node03.hff01.bf1.yahoo.com.ndmp: Flags [.], cksum 0x0ccc (correct), ack 3213, win 159, options [nop,nop,TS val 1083059484 ecr 3019493207], length 0
23:58:57.921073 IP (tos 0x0, ttl 64, id 51822, offset 0, flags [DF], proto TCP (6), length 52)
    netapp-master9.bkp.bf1.yahoo.com.51432 > node03.hff01.bf1.yahoo.com.ndmp: Flags [.], cksum 0xfcaf (correct), ack 3289, win 159, options [nop,nop,TS val 1083061507 ecr 3019495232], length 0
23:58:57.929958 IP (tos 0x0, ttl 64, id 51823, offset 0, flags [DF], proto TCP (6), length 52)
    netapp-master9.bkp.bf1.yahoo.com.51432 > node03.hff01.bf1.yahoo.com.ndmp: Flags [.], cksum 0xfc4e (correct), ack 3369, win 159, options [nop,nop,TS val 1083061516 ecr 3019495240], length 0
23:58:57.940567 IP (tos 0x0, ttl 64, id 51824, offset 0, flags [DF], proto TCP (6), length 52)
    netapp-master9.bkp.bf1.yahoo.com.51432 > node03.hff01.bf1.yahoo.com.ndmp: Flags [.], cksum 0xfbf8 (correct), ack 3433, win 159, options [nop,nop,TS val 1083061527 ecr 3019495251], length 0
23:58:57.949874 IP (tos 0x0, ttl 64, id 51825, offset 0, flags [DF], proto TCP (6), length 52)
    netapp-master9.bkp.bf1.yahoo.com.51432 > node03.hff01.bf1.yahoo.com.ndmp: Flags [.], cksum 0xfba2 (correct), ack 3501, win 159, options [nop,nop,TS val 1083061536 ecr 3019495260], length 0
23:58:57.990335 IP (tos 0x0, ttl 64, id 44847, offset 0, flags [DF], proto TCP (6), length 80)
    netapp-master9.bkp.bf1.yahoo.com.42181 > node03.hff01.bf1.yahoo.com.ndmp: Flags [P.], cksum 0xb478 (incorrect -> 0xfd9e), seq 1512:1540, ack 5729, win 148, options [nop,nop,TS val 1083061576 ecr 3338043385], length 28
23:58:57.990821 IP (tos 0x0, ttl 64, id 44848, offset 0, flags [DF], proto TCP (6), length 52)
    netapp-master9.bkp.bf1.yahoo.com.42181 > node03.hff01.bf1.yahoo.com.ndmp: Flags [.], cksum 0x1144 (correct), ack 5833, win 148, options [nop,nop,TS val 1083061577 ecr 3338048391], length 0
23:58:58.146620 IP (tos 0x0, ttl 64, id 51826, offset 0, flags [DF], proto TCP (6), length 52)
    netapp-master9.bkp.bf1.yahoo.com.51432 > node03.hff01.bf1.yahoo.com.ndmp: Flags [.], cksum 0xf985 (correct), ack 3637, win 170, options [nop,nop,TS val 1083061733 ecr 3019495457], length 0
23:58:58.366908 IP (tos 0x0, ttl 64, id 51827, offset 0, flags [DF], proto TCP (6), length 52)
    netapp-master9.bkp.bf1.yahoo.com.51432 > node03.hff01.bf1.yahoo.com.ndmp: Flags [.], cksum 0xf7ad (correct), ack 3669, win 170, options [nop,nop,TS val 1083061953 ecr 3019495677], length 0
23:58:58.367415 IP (tos 0x0, ttl 64, id 51828, offset 0, flags [DF], proto TCP (6), length 80)
    netapp-master9.bkp.bf1.yahoo.com.51432 > node03.hff01.bf1.yahoo.com.ndmp: Flags [P.], cksum 0xb478 (incorrect -> 0xe085), seq 756:784, ack 3669, win 170, options [nop,nop,TS val 1083061954 ecr 3019495677], length 28
23:58:58.407262 IP (tos 0x0, ttl 64, id 51829, offset 0, flags [DF], proto TCP (6), length 52)
    netapp-master9.bkp.bf1.yahoo.com.51432 > node03.hff01.bf1.yahoo.com.ndmp: Flags [.], cksum 0xf5f7 (correct), ack 4025, win 181, options [nop,nop,TS val 1083061994 ecr 3019495679], length 0
23:58:58.427661 IP (tos 0x0, ttl 64, id 51830, offset 0, flags [DF], proto TCP (6), length 80)
    netapp-master9.bkp.bf1.yahoo.com.51432 > node03.hff01.bf1.yahoo.com.ndmp: Flags [P.], cksum 0xb478 (incorrect -> 0xdeb8), seq 784:812, ack 4025, win 181, options [nop,nop,TS val 1083062014 ecr 3019495679], length 28
23:58:58.429748 IP (tos 0x0, ttl 64, id 51831, offset 0, flags [DF], proto TCP (6), length 52)
    netapp-master9.bkp.bf1.yahoo.com.51432 > node03.hff01.bf1.yahoo.com.ndmp: Flags [.], cksum 0xf568 (correct), ack 4057, win 181, options [nop,nop,TS val 1083062016 ecr 3019495740], length 0
23:58:58.430186 IP (tos 0x0, ttl 64, id 51832, offset 0, flags [DF], proto TCP (6), length 80)
    netapp-master9.bkp.bf1.yahoo.com.51432 > node03.hff01.bf1.yahoo.com.ndmp: Flags [P.], cksum 0xb478 (incorrect -> 0xd941), seq 812:840, ack 4057, win 181, options [nop,nop,TS val 1083062016 ecr 3019495740], length 28
23:58:58.430713 IP (tos 0x0, ttl 64, id 51833, offset 0, flags [DF], proto TCP (6), length 52)
    netapp-master9.bkp.bf1.yahoo.com.51432 > node03.hff01.bf1.yahoo.com.ndmp: Flags [R.], cksum 0xf509 (correct), seq 840, ack 4118, win 181, options [nop,nop,TS val 1083062017 ecr 3019495741], length 0
23:58:58.817368 IP (tos 0x0, ttl 64, id 60495, offset 0, flags [DF], proto TCP (6), length 80)
    netapp-master9.bkp.bf1.yahoo.com.35558 > node03.hff01.bf1.yahoo.com.ndmp: Flags [P.], cksum 0xb478 (incorrect -> 0xd83d), seq 1540:1568, ack 5833, win 170, options [nop,nop,TS val 1083062404 ecr 1933382050], length 28
23:58:58.819995 IP (tos 0x0, ttl 64, id 60496, offset 0, flags [DF], proto TCP (6), length 52)
    netapp-master9.bkp.bf1.yahoo.com.35558 > node03.hff01.bf1.yahoo.com.ndmp: Flags [.], cksum 0xebe4 (correct), ack 5937, win 170, options [nop,nop,TS val 1083062406 ecr 1933387059], length 0
23:59:02.996280 IP (tos 0x0, ttl 64, id 44849, offset 0, flags [DF], proto TCP (6), length 80)
    netapp-master9.bkp.bf1.yahoo.com.42181 > node03.hff01.bf1.yahoo.com.ndmp: Flags [P.], cksum 0xb478 (incorrect -> 0xd5f7), seq 1540:1568, ack 5833, win 148, options [nop,nop,TS val 1083066583 ecr 3338048391], length 28
23:59:02.999975 IP (tos 0x0, ttl 64, id 44850, offset 0, flags [DF], proto TCP (6), length 52)
    netapp-master9.bkp.bf1.yahoo.com.42181 > node03.hff01.bf1.yahoo.com.ndmp: Flags [.], cksum 0xe99d (correct), ack 5937, win 148, options [nop,nop,TS val 1083066586 ecr 3338053400], length 0
23:59:03.825542 IP (tos 0x0, ttl 64, id 60497, offset 0, flags [DF], proto TCP (6), length 80)
    netapp-master9.bkp.bf1.yahoo.com.35558 > node03.hff01.bf1.yahoo.com.ndmp: Flags [P.], cksum 0xb478 (incorrect -> 0xb092), seq 1568:1596, ack 5937, win 170, options [nop,nop,TS val 1083067412 ecr 1933387059], length 28
23:59:03.826701 IP (tos 0x0, ttl 64, id 60498, offset 0, flags [DF], proto TCP (6), length 52)
    netapp-master9.bkp.bf1.yahoo.com.35558 > node03.hff01.bf1.yahoo.com.ndmp: Flags [.], cksum 0xc442 (correct), ack 6041, win 170, options [nop,nop,TS val 1083067413 ecr 1933392066], length 0
23:59:08.005633 IP (tos 0x0, ttl 64, id 44851, offset 0, flags [DF], proto TCP (6), length 80)
    netapp-master9.bkp.bf1.yahoo.com.42181 > node03.hff01.bf1.yahoo.com.ndmp: Flags [P.], cksum 0xb478 (incorrect -> 0xae4a), seq 1568:1596, ack 5937, win 148, options [nop,nop,TS val 1083071592 ecr 3338053400], length 28
23:59:08.006137 IP (tos 0x0, ttl 64, id 44852, offset 0, flags [DF], proto TCP (6), length 52)
    netapp-master9.bkp.bf1.yahoo.com.42181 > node03.hff01.bf1.yahoo.com.ndmp: Flags [.], cksum 0xc1fd (correct), ack 6041, win 148, options [nop,nop,TS val 1083071592 ecr 3338058406], length 0
23:59:08.832359 IP (tos 0x0, ttl 64, id 60499, offset 0, flags [DF], proto TCP (6), length 80)
    netapp-master9.bkp.bf1.yahoo.com.35558 > node03.hff01.bf1.yahoo.com.ndmp: Flags [P.], cksum 0xb478 (incorrect -> 0x88ea), seq 1596:1624, ack 6041, win 170, options [nop,nop,TS val 1083072419 ecr 1933392066], length 28
23:59:08.833182 IP (tos 0x0, ttl 64, id 60500, offset 0, flags [DF], proto TCP (6), length 52)
    netapp-master9.bkp.bf1.yahoo.com.35558 > node03.hff01.bf1.yahoo.com.ndmp: Flags [.], cksum 0x9ca2 (correct), ack 6145, win 170, options [nop,nop,TS val 1083072419 ecr 1933397072], length 0
23:59:13.011764 IP (tos 0x0, ttl 64, id 44853, offset 0, flags [DF], proto TCP (6), length 80)
    netapp-master9.bkp.bf1.yahoo.com.42181 > node03.hff01.bf1.yahoo.com.ndmp: Flags [P.], cksum 0xb478 (incorrect -> 0x86a4), seq 1596:1624, ack 6041, win 148, options [nop,nop,TS val 1083076598 ecr 3338058406], length 28
23:59:13.012417 IP (tos 0x0, ttl 64, id 44854, offset 0, flags [DF], proto TCP (6), length 52)
    netapp-master9.bkp.bf1.yahoo.com.42181 > node03.hff01.bf1.yahoo.com.ndmp: Flags [.], cksum 0x9a5c (correct), ack 6145, win 148, options [nop,nop,TS val 1083076599 ecr 3338063412], length 0
23:59:13.838804 IP (tos 0x0, ttl 64, id 60501, offset 0, flags [DF], proto TCP (6), length 80)
    netapp-master9.bkp.bf1.yahoo.com.35558 > node03.hff01.bf1.yahoo.com.ndmp: Flags [P.], cksum 0xb478 (incorrect -> 0x6144), seq 1624:1652, ack 6145, win 170, options [nop,nop,TS val 1083077425 ecr 1933397072], length 28
23:59:13.839374 IP (tos 0x0, ttl 64, id 60502, offset 0, flags [DF], proto TCP (6), length 52)
    netapp-master9.bkp.bf1.yahoo.com.35558 > node03.hff01.bf1.yahoo.com.ndmp: Flags [.], cksum 0x7501 (correct), ack 6249, win 170, options [nop,nop,TS val 1083077426 ecr 1933402078], length 0
^C
289 packets captured
293 packets received by filter
0 packets dropped by kernel
