### ISSUE TITLE
tcpdump from archive-master1

### ISSUE THREAD

**Issue by senthily** [senthily/log#2]
[sensun@archive-master1.bkp.ne1 ~]$ sudo tcpdump -i eth0 dst 10.220.163.61 -v
Touch Yubikey:
tcpdump: listening on eth0, link-type EN10MB (Ethernet), capture size 65535 bytes
23:17:06.442658 IP (tos 0x0, ttl 64, id 17669, offset 0, flags [DF], proto TCP (6), length 60)
    archive-master1.bkp.ne1.yahoo.com.36185 > node02.usm112.mobstor.ne1.yahoo.com.ndmp: Flags [S], cksum 0xf5f4 (correct), seq 2379790295, win 14600, options [mss 1460,sackOK,TS val 1188754130 ecr 0,nop,wscale 7], length 0
23:17:06.443043 IP (tos 0x0, ttl 64, id 17670, offset 0, flags [DF], proto TCP (6), length 52)
    archive-master1.bkp.ne1.yahoo.com.36185 > node02.usm112.mobstor.ne1.yahoo.com.ndmp: Flags [.], cksum 0xcef9 (correct), ack 4243706090, win 115, options [nop,nop,TS val 1188754131 ecr 821858162], length 0
23:17:08.726857 IP (tos 0x0, ttl 64, id 17671, offset 0, flags [DF], proto TCP (6), length 52)
    archive-master1.bkp.ne1.yahoo.com.36185 > node02.usm112.mobstor.ne1.yahoo.com.ndmp: Flags [.], cksum 0xbce1 (correct), ack 65, win 115, options [nop,nop,TS val 1188756415 ecr 821860446], length 0
23:17:08.727624 IP (tos 0x0, ttl 64, id 17672, offset 0, flags [DF], proto TCP (6), length 84)
    archive-master1.bkp.ne1.yahoo.com.36185 > node02.usm112.mobstor.ne1.yahoo.com.ndmp: Flags [P.], cksum 0xe582 (incorrect -> 0xaa91), seq 0:32, ack 65, win 115, options [nop,nop,TS val 1188756415 ecr 821860446], length 32
23:17:08.731314 IP (tos 0x0, ttl 64, id 17673, offset 0, flags [DF], proto TCP (6), length 80)
    archive-master1.bkp.ne1.yahoo.com.36185 > node02.usm112.mobstor.ne1.yahoo.com.ndmp: Flags [P.], cksum 0xe57e (incorrect -> 0xb254), seq 32:60, ack 97, win 115, options [nop,nop,TS val 1188756419 ecr 821860450], length 28
23:17:08.732342 IP (tos 0x0, ttl 64, id 17674, offset 0, flags [DF], proto TCP (6), length 80)
    archive-master1.bkp.ne1.yahoo.com.36185 > node02.usm112.mobstor.ne1.yahoo.com.ndmp: Flags [P.], cksum 0xe57e (incorrect -> 0xb211), seq 60:88, ack 125, win 115, options [nop,nop,TS val 1188756420 ecr 821860451], length 28
23:17:08.734537 IP (tos 0x0, ttl 64, id 17675, offset 0, flags [DF], proto TCP (6), length 84)
    archive-master1.bkp.ne1.yahoo.com.36185 > node02.usm112.mobstor.ne1.yahoo.com.ndmp: Flags [P.], cksum 0xe582 (incorrect -> 0xb1b3), seq 88:120, ack 181, win 115, options [nop,nop,TS val 1188756422 ecr 821860453], length 32
23:17:08.735491 IP (tos 0x0, ttl 64, id 17676, offset 0, flags [DF], proto TCP (6), length 108)
    archive-master1.bkp.ne1.yahoo.com.36185 > node02.usm112.mobstor.ne1.yahoo.com.ndmp: Flags [P.], cksum 0xe59a (incorrect -> 0x1a68), seq 120:176, ack 281, win 115, options [nop,nop,TS val 1188756423 ecr 821860454], length 56
23:17:08.736484 IP (tos 0x0, ttl 64, id 17677, offset 0, flags [DF], proto TCP (6), length 80)
    archive-master1.bkp.ne1.yahoo.com.36185 > node02.usm112.mobstor.ne1.yahoo.com.ndmp: Flags [P.], cksum 0xe57e (incorrect -> 0xb0de), seq 176:204, ack 313, win 115, options [nop,nop,TS val 1188756424 ecr 821860455], length 28
23:17:08.776627 IP (tos 0x0, ttl 64, id 17678, offset 0, flags [DF], proto TCP (6), length 52)
    archive-master1.bkp.ne1.yahoo.com.36185 > node02.usm112.mobstor.ne1.yahoo.com.ndmp: Flags [.], cksum 0xba95 (correct), ack 389, win 115, options [nop,nop,TS val 1188756465 ecr 821860456], length 0
23:17:08.777007 IP (tos 0x0, ttl 64, id 17679, offset 0, flags [DF], proto TCP (6), length 52)
    archive-master1.bkp.ne1.yahoo.com.36185 > node02.usm112.mobstor.ne1.yahoo.com.ndmp: Flags [.], cksum 0xb9f9 (correct), ack 505, win 115, options [nop,nop,TS val 1188756465 ecr 821860496], length 0
23:17:08.777684 IP (tos 0x0, ttl 64, id 17680, offset 0, flags [DF], proto TCP (6), length 80)
    archive-master1.bkp.ne1.yahoo.com.36185 > node02.usm112.mobstor.ne1.yahoo.com.ndmp: Flags [P.], cksum 0xe57e (incorrect -> 0xafa6), seq 204:232, ack 505, win 115, options [nop,nop,TS val 1188756466 ecr 821860496], length 28
23:17:08.778731 IP (tos 0x0, ttl 64, id 17681, offset 0, flags [DF], proto TCP (6), length 84)
    archive-master1.bkp.ne1.yahoo.com.36185 > node02.usm112.mobstor.ne1.yahoo.com.ndmp: Flags [P.], cksum 0xe582 (incorrect -> 0xaf0a), seq 232:264, ack 625, win 115, options [nop,nop,TS val 1188756467 ecr 821860497], length 32
23:17:08.780967 IP (tos 0x0, ttl 64, id 17682, offset 0, flags [DF], proto TCP (6), length 80)
    archive-master1.bkp.ne1.yahoo.com.36185 > node02.usm112.mobstor.ne1.yahoo.com.ndmp: Flags [P.], cksum 0xe57e (incorrect -> 0xae84), seq 264:292, ack 725, win 115, options [nop,nop,TS val 1188756469 ecr 821860499], length 28
23:17:08.781946 IP (tos 0x0, ttl 64, id 17683, offset 0, flags [DF], proto TCP (6), length 80)
    archive-master1.bkp.ne1.yahoo.com.36185 > node02.usm112.mobstor.ne1.yahoo.com.ndmp: Flags [P.], cksum 0xe57e (incorrect -> 0xae3c), seq 292:320, ack 773, win 115, options [nop,nop,TS val 1188756470 ecr 821860501], length 28
23:17:08.782851 IP (tos 0x0, ttl 64, id 17684, offset 0, flags [DF], proto TCP (6), length 80)
    archive-master1.bkp.ne1.yahoo.com.36185 > node02.usm112.mobstor.ne1.yahoo.com.ndmp: Flags [P.], cksum 0xe57e (incorrect -> 0xadef), seq 320:348, ack 817, win 115, options [nop,nop,TS val 1188756471 ecr 821860502], length 28
23:17:08.822803 IP (tos 0x0, ttl 64, id 17685, offset 0, flags [DF], proto TCP (6), length 52)
    archive-master1.bkp.ne1.yahoo.com.36185 > node02.usm112.mobstor.ne1.yahoo.com.ndmp: Flags [.], cksum 0xb529 (correct), ack 1529, win 126, options [nop,nop,TS val 1188756511 ecr 821860503], length 0
23:17:08.827621 IP (tos 0x0, ttl 64, id 17686, offset 0, flags [DF], proto TCP (6), length 80)
    archive-master1.bkp.ne1.yahoo.com.36185 > node02.usm112.mobstor.ne1.yahoo.com.ndmp: Flags [P.], cksum 0xe57e (incorrect -> 0xaacc), seq 348:376, ack 1529, win 126, options [nop,nop,TS val 1188756515 ecr 821860503], length 28
23:17:08.828098 IP (tos 0x0, ttl 64, id 17687, offset 0, flags [DF], proto TCP (6), length 52)
    archive-master1.bkp.ne1.yahoo.com.36185 > node02.usm112.mobstor.ne1.yahoo.com.ndmp: Flags [.], cksum 0xb4ac (correct), ack 1577, win 126, options [nop,nop,TS val 1188756516 ecr 821860547], length 0
23:17:08.887306 IP (tos 0x0, ttl 64, id 17688, offset 0, flags [DF], proto TCP (6), length 80)
    archive-master1.bkp.ne1.yahoo.com.36185 > node02.usm112.mobstor.ne1.yahoo.com.ndmp: Flags [P.], cksum 0xe57e (incorrect -> 0xaa1f), seq 376:404, ack 1577, win 126, options [nop,nop,TS val 1188756575 ecr 821860547], length 28
23:17:08.887727 IP (tos 0x0, ttl 64, id 17689, offset 0, flags [DF], proto TCP (6), length 52)
    archive-master1.bkp.ne1.yahoo.com.36185 > node02.usm112.mobstor.ne1.yahoo.com.ndmp: Flags [.], cksum 0xb3ec (correct), ack 1621, win 126, options [nop,nop,TS val 1188756576 ecr 821860607], length 0
23:20:15.162869 IP (tos 0x0, ttl 64, id 17690, offset 0, flags [DF], proto TCP (6), length 52)
    archive-master1.bkp.ne1.yahoo.com.36185 > node02.usm112.mobstor.ne1.yahoo.com.ndmp: Flags [R.], cksum 0xdc42 (correct), seq 404, ack 1621, win 126, options [nop,nop,TS val 1188942851 ecr 821860607], length 0

^C
22 packets captured
25 packets received by filter
0 packets dropped by kernel
