### ISSUE TITLE
netapp-master9.bkp.bf1 to node03.hff01.bf1.yahoo.com

### ISSUE THREAD

**Issue by senthily** [senthily/log#3]
-bash-4.1$ sudo tcpdump -i eth0 dst 69.147.73.26 -v
tcpdump: listening on eth0, link-type EN10MB (Ethernet), capture size 65535 bytes
23:47:27.150720 IP (tos 0x0, ttl 64, id 44569, offset 0, flags [DF], proto TCP (6), length 80)
    netapp-master9.bkp.bf1.yahoo.com.42181 > node03.hff01.bf1.yahoo.com.ndmp: Flags [P.], cksum 0xb478 (incorrect -> 0x5e27), seq 702078332:702078360, ack 3935361553, win 148, options [nop,nop,TS val 1082370737 ecr 3337352545], length 28
23:47:27.152647 IP (tos 0x0, ttl 64, id 44570, offset 0, flags [DF], proto TCP (6), length 52)
    netapp-master9.bkp.bf1.yahoo.com.42181 > node03.hff01.bf1.yahoo.com.ndmp: Flags [.], cksum 0x6e8d (correct), ack 105, win 148, options [nop,nop,TS val 1082370739 ecr 3337357553], length 0
23:47:27.958842 IP (tos 0x0, ttl 64, id 60217, offset 0, flags [DF], proto TCP (6), length 80)
    netapp-master9.bkp.bf1.yahoo.com.35558 > node03.hff01.bf1.yahoo.com.ndmp: Flags [P.], cksum 0xb478 (incorrect -> 0x38ed), seq 808919764:808919792, ack 1088108042, win 170, options [nop,nop,TS val 1082371545 ecr 1932691192], length 28
23:47:27.959535 IP (tos 0x0, ttl 64, id 60218, offset 0, flags [DF], proto TCP (6), length 52)
    netapp-master9.bkp.bf1.yahoo.com.35558 > node03.hff01.bf1.yahoo.com.ndmp: Flags [.], cksum 0x495b (correct), ack 105, win 170, options [nop,nop,TS val 1082371546 ecr 1932696198], length 0
23:47:30.517401 IP (tos 0x0, ttl 64, id 64304, offset 0, flags [DF], proto TCP (6), length 60)
    netapp-master9.bkp.bf1.yahoo.com.51841 > node03.hff01.bf1.yahoo.com.ndmp: Flags [S], cksum 0x087c (correct), seq 460344552, win 14600, options [mss 1460,sackOK,TS val 1082374104 ecr 0,nop,wscale 7], length 0
23:47:30.517866 IP (tos 0x0, ttl 64, id 64305, offset 0, flags [DF], proto TCP (6), length 52)
    netapp-master9.bkp.bf1.yahoo.com.51841 > node03.hff01.bf1.yahoo.com.ndmp: Flags [.], cksum 0xfb32 (correct), ack 1898122594, win 115, options [nop,nop,TS val 1082374104 ecr 3183294551], length 0
23:47:32.158167 IP (tos 0x0, ttl 64, id 44571, offset 0, flags [DF], proto TCP (6), length 80)
    netapp-master9.bkp.bf1.yahoo.com.42181 > node03.hff01.bf1.yahoo.com.ndmp: Flags [P.], cksum 0xb478 (incorrect -> 0x367e), seq 28:56, ack 105, win 148, options [nop,nop,TS val 1082375744 ecr 3337357553], length 28
23:47:32.158959 IP (tos 0x0, ttl 64, id 44572, offset 0, flags [DF], proto TCP (6), length 52)
    netapp-master9.bkp.bf1.yahoo.com.42181 > node03.hff01.bf1.yahoo.com.ndmp: Flags [.], cksum 0x46ed (correct), ack 209, win 148, options [nop,nop,TS val 1082375745 ecr 3337362559], length 0
23:47:32.770099 IP (tos 0x0, ttl 64, id 64306, offset 0, flags [DF], proto TCP (6), length 52)
    netapp-master9.bkp.bf1.yahoo.com.51841 > node03.hff01.bf1.yahoo.com.ndmp: Flags [.], cksum 0xe95a (correct), ack 65, win 115, options [nop,nop,TS val 1082376356 ecr 3183296803], length 0
23:47:32.770536 IP (tos 0x0, ttl 64, id 64307, offset 0, flags [DF], proto TCP (6), length 84)
    netapp-master9.bkp.bf1.yahoo.com.51841 > node03.hff01.bf1.yahoo.com.ndmp: Flags [P.], cksum 0xb47c (incorrect -> 0xcfe9), seq 0:32, ack 65, win 115, options [nop,nop,TS val 1082376357 ecr 3183296803], length 32
23:47:32.771564 IP (tos 0x0, ttl 64, id 64308, offset 0, flags [DF], proto TCP (6), length 80)
    netapp-master9.bkp.bf1.yahoo.com.51841 > node03.hff01.bf1.yahoo.com.ndmp: Flags [P.], cksum 0xb478 (incorrect -> 0xd7b2), seq 32:60, ack 97, win 115, options [nop,nop,TS val 1082376358 ecr 3183296804], length 28
23:47:32.772508 IP (tos 0x0, ttl 64, id 64309, offset 0, flags [DF], proto TCP (6), length 80)
    netapp-master9.bkp.bf1.yahoo.com.51841 > node03.hff01.bf1.yahoo.com.ndmp: Flags [P.], cksum 0xb478 (incorrect -> 0xd76f), seq 60:88, ack 125, win 115, options [nop,nop,TS val 1082376359 ecr 3183296805], length 28
23:47:32.777730 IP (tos 0x0, ttl 64, id 64310, offset 0, flags [DF], proto TCP (6), length 84)
    netapp-master9.bkp.bf1.yahoo.com.51841 > node03.hff01.bf1.yahoo.com.ndmp: Flags [P.], cksum 0xb47c (incorrect -> 0xd70e), seq 88:120, ack 181, win 115, options [nop,nop,TS val 1082376364 ecr 3183296807], length 32
23:47:32.778621 IP (tos 0x0, ttl 64, id 64311, offset 0, flags [DF], proto TCP (6), length 108)
    netapp-master9.bkp.bf1.yahoo.com.51841 > node03.hff01.bf1.yahoo.com.ndmp: Flags [P.], cksum 0xb494 (incorrect -> 0xc4c7), seq 120:176, ack 281, win 115, options [nop,nop,TS val 1082376365 ecr 3183296811], length 56
23:47:32.779454 IP (tos 0x0, ttl 64, id 64312, offset 0, flags [DF], proto TCP (6), length 80)
    netapp-master9.bkp.bf1.yahoo.com.51841 > node03.hff01.bf1.yahoo.com.ndmp: Flags [P.], cksum 0xb478 (incorrect -> 0xd636), seq 176:204, ack 313, win 115, options [nop,nop,TS val 1082376366 ecr 3183296812], length 28
23:47:32.819262 IP (tos 0x0, ttl 64, id 64313, offset 0, flags [DF], proto TCP (6), length 52)
    netapp-master9.bkp.bf1.yahoo.com.51841 > node03.hff01.bf1.yahoo.com.ndmp: Flags [.], cksum 0xe70f (correct), ack 389, win 115, options [nop,nop,TS val 1082376406 ecr 3183296812], length 0
23:47:32.819717 IP (tos 0x0, ttl 64, id 64314, offset 0, flags [DF], proto TCP (6), length 52)
    netapp-master9.bkp.bf1.yahoo.com.51841 > node03.hff01.bf1.yahoo.com.ndmp: Flags [.], cksum 0xe67f (correct), ack 493, win 115, options [nop,nop,TS val 1082376406 ecr 3183296852], length 0
23:47:32.820136 IP (tos 0x0, ttl 64, id 64315, offset 0, flags [DF], proto TCP (6), length 80)
    netapp-master9.bkp.bf1.yahoo.com.51841 > node03.hff01.bf1.yahoo.com.ndmp: Flags [P.], cksum 0xb478 (incorrect -> 0xd50d), seq 204:232, ack 493, win 115, options [nop,nop,TS val 1082376406 ecr 3183296852], length 28
23:47:32.821045 IP (tos 0x0, ttl 64, id 64316, offset 0, flags [DF], proto TCP (6), length 84)
    netapp-master9.bkp.bf1.yahoo.com.51841 > node03.hff01.bf1.yahoo.com.ndmp: Flags [P.], cksum 0xb47c (incorrect -> 0xd471), seq 232:264, ack 613, win 115, options [nop,nop,TS val 1082376407 ecr 3183296853], length 32
23:47:32.821928 IP (tos 0x0, ttl 64, id 64317, offset 0, flags [DF], proto TCP (6), length 80)
    netapp-master9.bkp.bf1.yahoo.com.51841 > node03.hff01.bf1.yahoo.com.ndmp: Flags [P.], cksum 0xb478 (incorrect -> 0xd3f5), seq 264:292, ack 713, win 115, options [nop,nop,TS val 1082376408 ecr 3183296854], length 28
23:47:32.822690 IP (tos 0x0, ttl 64, id 64318, offset 0, flags [DF], proto TCP (6), length 80)
    netapp-master9.bkp.bf1.yahoo.com.51841 > node03.hff01.bf1.yahoo.com.ndmp: Flags [P.], cksum 0xb478 (incorrect -> 0xd3a8), seq 292:320, ack 757, win 115, options [nop,nop,TS val 1082376409 ecr 3183296855], length 28
23:47:32.847346 IP (tos 0x0, ttl 64, id 64319, offset 0, flags [DF], proto TCP (6), length 80)
    netapp-master9.bkp.bf1.yahoo.com.51841 > node03.hff01.bf1.yahoo.com.ndmp: Flags [P.], cksum 0xb478 (incorrect -> 0xd098), seq 320:348, ack 1469, win 126, options [nop,nop,TS val 1082376434 ecr 3183296856], length 28
23:47:32.861891 IP (tos 0x0, ttl 64, id 64320, offset 0, flags [DF], proto TCP (6), length 80)
    netapp-master9.bkp.bf1.yahoo.com.51841 > node03.hff01.bf1.yahoo.com.ndmp: Flags [P.], cksum 0xb478 (incorrect -> 0xd02b), seq 348:376, ack 1517, win 126, options [nop,nop,TS val 1082376448 ecr 3183296882], length 28
23:47:32.902258 IP (tos 0x0, ttl 64, id 64321, offset 0, flags [DF], proto TCP (6), length 52)
    netapp-master9.bkp.bf1.yahoo.com.51841 > node03.hff01.bf1.yahoo.com.ndmp: Flags [.], cksum 0xe11e (correct), ack 1561, win 126, options [nop,nop,TS val 1082376489 ecr 3183296895], length 0
23:47:32.965072 IP (tos 0x0, ttl 64, id 60219, offset 0, flags [DF], proto TCP (6), length 80)
    netapp-master9.bkp.bf1.yahoo.com.35558 > node03.hff01.bf1.yahoo.com.ndmp: Flags [P.], cksum 0xb478 (incorrect -> 0x1147), seq 28:56, ack 105, win 170, options [nop,nop,TS val 1082376551 ecr 1932696198], length 28
23:47:32.965670 IP (tos 0x0, ttl 64, id 60220, offset 0, flags [DF], proto TCP (6), length 52)
    netapp-master9.bkp.bf1.yahoo.com.35558 > node03.hff01.bf1.yahoo.com.ndmp: Flags [.], cksum 0x21bb (correct), ack 209, win 170, options [nop,nop,TS val 1082376552 ecr 1932701204], length 0
23:47:37.164507 IP (tos 0x0, ttl 64, id 44573, offset 0, flags [DF], proto TCP (6), length 80)
    netapp-master9.bkp.bf1.yahoo.com.42181 > node03.hff01.bf1.yahoo.com.ndmp: Flags [P.], cksum 0xb478 (incorrect -> 0x0ed7), seq 56:84, ack 209, win 148, options [nop,nop,TS val 1082380751 ecr 3337362559], length 28
23:47:37.165039 IP (tos 0x0, ttl 64, id 44574, offset 0, flags [DF], proto TCP (6), length 52)
    netapp-master9.bkp.bf1.yahoo.com.42181 > node03.hff01.bf1.yahoo.com.ndmp: Flags [.], cksum 0x1f4d (correct), ack 313, win 148, options [nop,nop,TS val 1082380751 ecr 3337367565], length 0
23:47:37.971259 IP (tos 0x0, ttl 64, id 60221, offset 0, flags [DF], proto TCP (6), length 80)
    netapp-master9.bkp.bf1.yahoo.com.35558 > node03.hff01.bf1.yahoo.com.ndmp: Flags [P.], cksum 0xb478 (incorrect -> 0xe99f), seq 56:84, ack 209, win 170, options [nop,nop,TS val 1082381558 ecr 1932701204], length 28
23:47:37.971797 IP (tos 0x0, ttl 64, id 60222, offset 0, flags [DF], proto TCP (6), length 52)
    netapp-master9.bkp.bf1.yahoo.com.35558 > node03.hff01.bf1.yahoo.com.ndmp: Flags [.], cksum 0xfa19 (correct), ack 313, win 170, options [nop,nop,TS val 1082381558 ecr 1932706211], length 0
23:47:42.170641 IP (tos 0x0, ttl 64, id 44575, offset 0, flags [DF], proto TCP (6), length 80)
    netapp-master9.bkp.bf1.yahoo.com.42181 > node03.hff01.bf1.yahoo.com.ndmp: Flags [P.], cksum 0xb478 (incorrect -> 0xe730), seq 84:112, ack 313, win 148, options [nop,nop,TS val 1082385757 ecr 3337367565], length 28
23:47:42.171154 IP (tos 0x0, ttl 64, id 44576, offset 0, flags [DF], proto TCP (6), length 52)
    netapp-master9.bkp.bf1.yahoo.com.42181 > node03.hff01.bf1.yahoo.com.ndmp: Flags [.], cksum 0xf7ac (correct), ack 417, win 148, options [nop,nop,TS val 1082385757 ecr 3337372571], length 0
23:47:42.977371 IP (tos 0x0, ttl 64, id 60223, offset 0, flags [DF], proto TCP (6), length 80)
    netapp-master9.bkp.bf1.yahoo.com.35558 > node03.hff01.bf1.yahoo.com.ndmp: Flags [P.], cksum 0xb478 (incorrect -> 0xc1f8), seq 84:112, ack 313, win 170, options [nop,nop,TS val 1082386564 ecr 1932706211], length 28
23:47:42.977986 IP (tos 0x0, ttl 64, id 60224, offset 0, flags [DF], proto TCP (6), length 52)
    netapp-master9.bkp.bf1.yahoo.com.35558 > node03.hff01.bf1.yahoo.com.ndmp: Flags [.], cksum 0xd279 (correct), ack 417, win 170, options [nop,nop,TS val 1082386564 ecr 1932711217], length 0
23:47:47.176597 IP (tos 0x0, ttl 64, id 44577, offset 0, flags [DF], proto TCP (6), length 80)
    netapp-master9.bkp.bf1.yahoo.com.42181 > node03.hff01.bf1.yahoo.com.ndmp: Flags [P.], cksum 0xb478 (incorrect -> 0xbf8a), seq 112:140, ack 417, win 148, options [nop,nop,TS val 1082390763 ecr 3337372571], length 28
23:47:47.177171 IP (tos 0x0, ttl 64, id 44578, offset 0, flags [DF], proto TCP (6), length 52)
    netapp-master9.bkp.bf1.yahoo.com.42181 > node03.hff01.bf1.yahoo.com.ndmp: Flags [.], cksum 0xd00c (correct), ack 521, win 148, options [nop,nop,TS val 1082390763 ecr 3337377577], length 0
23:47:47.983567 IP (tos 0x0, ttl 64, id 60225, offset 0, flags [DF], proto TCP (6), length 80)
    netapp-master9.bkp.bf1.yahoo.com.35558 > node03.hff01.bf1.yahoo.com.ndmp: Flags [P.], cksum 0xb478 (incorrect -> 0x9a52), seq 112:140, ack 417, win 170, options [nop,nop,TS val 1082391570 ecr 1932711217], length 28
23:47:47.984270 IP (tos 0x0, ttl 64, id 60226, offset 0, flags [DF], proto TCP (6), length 52)
    netapp-master9.bkp.bf1.yahoo.com.35558 > node03.hff01.bf1.yahoo.com.ndmp: Flags [.], cksum 0xaad8 (correct), ack 521, win 170, options [nop,nop,TS val 1082391571 ecr 1932716223], length 0
23:47:52.182718 IP (tos 0x0, ttl 64, id 44579, offset 0, flags [DF], proto TCP (6), length 80)
    netapp-master9.bkp.bf1.yahoo.com.42181 > node03.hff01.bf1.yahoo.com.ndmp: Flags [P.], cksum 0xb478 (incorrect -> 0x97e4), seq 140:168, ack 521, win 148, options [nop,nop,TS val 1082395769 ecr 3337377577], length 28
23:47:52.183911 IP (tos 0x0, ttl 64, id 44580, offset 0, flags [DF], proto TCP (6), length 52)
    netapp-master9.bkp.bf1.yahoo.com.42181 > node03.hff01.bf1.yahoo.com.ndmp: Flags [.], cksum 0xa86b (correct), ack 625, win 148, options [nop,nop,TS val 1082395770 ecr 3337382583], length 0
23:47:52.989889 IP (tos 0x0, ttl 64, id 60227, offset 0, flags [DF], proto TCP (6), length 80)
    netapp-master9.bkp.bf1.yahoo.com.35558 > node03.hff01.bf1.yahoo.com.ndmp: Flags [P.], cksum 0xb478 (incorrect -> 0x72ac), seq 140:168, ack 521, win 170, options [nop,nop,TS val 1082396576 ecr 1932716223], length 28
23:47:52.990406 IP (tos 0x0, ttl 64, id 60228, offset 0, flags [DF], proto TCP (6), length 52)
    netapp-master9.bkp.bf1.yahoo.com.35558 > node03.hff01.bf1.yahoo.com.ndmp: Flags [.], cksum 0x8338 (correct), ack 625, win 170, options [nop,nop,TS val 1082396577 ecr 1932721229], length 0
23:47:57.189451 IP (tos 0x0, ttl 64, id 44581, offset 0, flags [DF], proto TCP (6), length 80)
    netapp-master9.bkp.bf1.yahoo.com.42181 > node03.hff01.bf1.yahoo.com.ndmp: Flags [P.], cksum 0xb478 (incorrect -> 0x703d), seq 168:196, ack 625, win 148, options [nop,nop,TS val 1082400776 ecr 3337382583], length 28
23:47:57.189994 IP (tos 0x0, ttl 64, id 44582, offset 0, flags [DF], proto TCP (6), length 52)
    netapp-master9.bkp.bf1.yahoo.com.42181 > node03.hff01.bf1.yahoo.com.ndmp: Flags [.], cksum 0x80ca (correct), ack 729, win 148, options [nop,nop,TS val 1082400776 ecr 3337387590], length 0
23:47:57.995918 IP (tos 0x0, ttl 64, id 60229, offset 0, flags [DF], proto TCP (6), length 80)
    netapp-master9.bkp.bf1.yahoo.com.35558 > node03.hff01.bf1.yahoo.com.ndmp: Flags [P.], cksum 0xb478 (incorrect -> 0x4b06), seq 168:196, ack 625, win 170, options [nop,nop,TS val 1082401582 ecr 1932721229], length 28
23:47:57.996763 IP (tos 0x0, ttl 64, id 60230, offset 0, flags [DF], proto TCP (6), length 52)
    netapp-master9.bkp.bf1.yahoo.com.35558 > node03.hff01.bf1.yahoo.com.ndmp: Flags [.], cksum 0x5b97 (correct), ack 729, win 170, options [nop,nop,TS val 1082401583 ecr 1932726236], length 0
23:48:02.195513 IP (tos 0x0, ttl 64, id 44583, offset 0, flags [DF], proto TCP (6), length 80)
    netapp-master9.bkp.bf1.yahoo.com.42181 > node03.hff01.bf1.yahoo.com.ndmp: Flags [P.], cksum 0xb478 (incorrect -> 0x4896), seq 196:224, ack 729, win 148, options [nop,nop,TS val 1082405782 ecr 3337387590], length 28
23:48:02.196014 IP (tos 0x0, ttl 64, id 44584, offset 0, flags [DF], proto TCP (6), length 52)
    netapp-master9.bkp.bf1.yahoo.com.42181 > node03.hff01.bf1.yahoo.com.ndmp: Flags [.], cksum 0x592a (correct), ack 833, win 148, options [nop,nop,TS val 1082405782 ecr 3337392596], length 0
23:48:03.002195 IP (tos 0x0, ttl 64, id 60231, offset 0, flags [DF], proto TCP (6), length 80)
    netapp-master9.bkp.bf1.yahoo.com.35558 > node03.hff01.bf1.yahoo.com.ndmp: Flags [P.], cksum 0xb478 (incorrect -> 0x235e), seq 196:224, ack 729, win 170, options [nop,nop,TS val 1082406588 ecr 1932726236], length 28
23:48:03.002690 IP (tos 0x0, ttl 64, id 60232, offset 0, flags [DF], proto TCP (6), length 52)
    netapp-master9.bkp.bf1.yahoo.com.35558 > node03.hff01.bf1.yahoo.com.ndmp: Flags [.], cksum 0x33f7 (correct), ack 833, win 170, options [nop,nop,TS val 1082406589 ecr 1932731242], length 0
23:48:07.201600 IP (tos 0x0, ttl 64, id 44585, offset 0, flags [DF], proto TCP (6), length 80)
    netapp-master9.bkp.bf1.yahoo.com.42181 > node03.hff01.bf1.yahoo.com.ndmp: Flags [P.], cksum 0xb478 (incorrect -> 0x20f0), seq 224:252, ack 833, win 148, options [nop,nop,TS val 1082410788 ecr 3337392596], length 28
23:48:07.202083 IP (tos 0x0, ttl 64, id 44586, offset 0, flags [DF], proto TCP (6), length 52)
    netapp-master9.bkp.bf1.yahoo.com.42181 > node03.hff01.bf1.yahoo.com.ndmp: Flags [.], cksum 0x318a (correct), ack 937, win 148, options [nop,nop,TS val 1082410788 ecr 3337397602], length 0
23:48:08.008256 IP (tos 0x0, ttl 64, id 60233, offset 0, flags [DF], proto TCP (6), length 80)
    netapp-master9.bkp.bf1.yahoo.com.35558 > node03.hff01.bf1.yahoo.com.ndmp: Flags [P.], cksum 0xb478 (incorrect -> 0xfbb7), seq 224:252, ack 833, win 170, options [nop,nop,TS val 1082411594 ecr 1932731242], length 28
23:48:08.009133 IP (tos 0x0, ttl 64, id 60234, offset 0, flags [DF], proto TCP (6), length 52)
    netapp-master9.bkp.bf1.yahoo.com.35558 > node03.hff01.bf1.yahoo.com.ndmp: Flags [.], cksum 0x0c57 (correct), ack 937, win 170, options [nop,nop,TS val 1082411595 ecr 1932736248], length 0
23:48:12.207599 IP (tos 0x0, ttl 64, id 44587, offset 0, flags [DF], proto TCP (6), length 80)
    netapp-master9.bkp.bf1.yahoo.com.42181 > node03.hff01.bf1.yahoo.com.ndmp: Flags [P.], cksum 0xb478 (incorrect -> 0xf949), seq 252:280, ack 937, win 148, options [nop,nop,TS val 1082415794 ecr 3337397602], length 28
23:48:12.208297 IP (tos 0x0, ttl 64, id 44588, offset 0, flags [DF], proto TCP (6), length 52)
    netapp-master9.bkp.bf1.yahoo.com.42181 > node03.hff01.bf1.yahoo.com.ndmp: Flags [.], cksum 0x09e9 (correct), ack 1041, win 148, options [nop,nop,TS val 1082415795 ecr 3337402608], length 0
23:48:13.014354 IP (tos 0x0, ttl 64, id 60235, offset 0, flags [DF], proto TCP (6), length 80)
    netapp-master9.bkp.bf1.yahoo.com.35558 > node03.hff01.bf1.yahoo.com.ndmp: Flags [P.], cksum 0xb478 (incorrect -> 0xd410), seq 252:280, ack 937, win 170, options [nop,nop,TS val 1082416601 ecr 1932736248], length 28
23:48:13.014907 IP (tos 0x0, ttl 64, id 60236, offset 0, flags [DF], proto TCP (6), length 52)
    netapp-master9.bkp.bf1.yahoo.com.35558 > node03.hff01.bf1.yahoo.com.ndmp: Flags [.], cksum 0xe4b6 (correct), ack 1041, win 170, options [nop,nop,TS val 1082416601 ecr 1932741254], length 0
23:48:17.213832 IP (tos 0x0, ttl 64, id 44589, offset 0, flags [DF], proto TCP (6), length 80)
    netapp-master9.bkp.bf1.yahoo.com.42181 > node03.hff01.bf1.yahoo.com.ndmp: Flags [P.], cksum 0xb478 (incorrect -> 0xd1a3), seq 280:308, ack 1041, win 148, options [nop,nop,TS val 1082420800 ecr 3337402608], length 28
23:48:17.217517 IP (tos 0x0, ttl 64, id 44590, offset 0, flags [DF], proto TCP (6), length 52)
    netapp-master9.bkp.bf1.yahoo.com.42181 > node03.hff01.bf1.yahoo.com.ndmp: Flags [.], cksum 0xe241 (correct), ack 1145, win 148, options [nop,nop,TS val 1082420804 ecr 3337407618], length 0
23:48:18.020503 IP (tos 0x0, ttl 64, id 60237, offset 0, flags [DF], proto TCP (6), length 80)
    netapp-master9.bkp.bf1.yahoo.com.35558 > node03.hff01.bf1.yahoo.com.ndmp: Flags [P.], cksum 0xb478 (incorrect -> 0xac6a), seq 280:308, ack 1041, win 170, options [nop,nop,TS val 1082421607 ecr 1932741254], length 28
23:48:18.021013 IP (tos 0x0, ttl 64, id 60238, offset 0, flags [DF], proto TCP (6), length 52)
    netapp-master9.bkp.bf1.yahoo.com.35558 > node03.hff01.bf1.yahoo.com.ndmp: Flags [.], cksum 0xbd16 (correct), ack 1145, win 170, options [nop,nop,TS val 1082421607 ecr 1932746260], length 0
23:48:22.223073 IP (tos 0x0, ttl 64, id 44591, offset 0, flags [DF], proto TCP (6), length 80)
    netapp-master9.bkp.bf1.yahoo.com.42181 > node03.hff01.bf1.yahoo.com.ndmp: Flags [P.], cksum 0xb478 (incorrect -> 0xa9f6), seq 308:336, ack 1145, win 148, options [nop,nop,TS val 1082425809 ecr 3337407618], length 28
23:48:22.223671 IP (tos 0x0, ttl 64, id 44592, offset 0, flags [DF], proto TCP (6), length 52)
    netapp-master9.bkp.bf1.yahoo.com.42181 > node03.hff01.bf1.yahoo.com.ndmp: Flags [.], cksum 0xbaa1 (correct), ack 1249, win 148, options [nop,nop,TS val 1082425810 ecr 3337412624], length 0
23:48:23.026595 IP (tos 0x0, ttl 64, id 60239, offset 0, flags [DF], proto TCP (6), length 80)
    netapp-master9.bkp.bf1.yahoo.com.35558 > node03.hff01.bf1.yahoo.com.ndmp: Flags [P.], cksum 0xb478 (incorrect -> 0x84c4), seq 308:336, ack 1145, win 170, options [nop,nop,TS val 1082426613 ecr 1932746260], length 28
23:48:23.027414 IP (tos 0x0, ttl 64, id 60240, offset 0, flags [DF], proto TCP (6), length 52)
    netapp-master9.bkp.bf1.yahoo.com.35558 > node03.hff01.bf1.yahoo.com.ndmp: Flags [.], cksum 0x9575 (correct), ack 1249, win 170, options [nop,nop,TS val 1082426614 ecr 1932751266], length 0
23:48:25.785210 IP (tos 0x0, ttl 64, id 64322, offset 0, flags [DF], proto TCP (6), length 100)
    netapp-master9.bkp.bf1.yahoo.com.51841 > node03.hff01.bf1.yahoo.com.ndmp: Flags [P.], cksum 0xb48c (incorrect -> 0x5866), seq 376:424, ack 1561, win 126, options [nop,nop,TS val 1082429371 ecr 3183296895], length 48
23:48:25.796543 IP (tos 0x0, ttl 64, id 64323, offset 0, flags [DF], proto TCP (6), length 52)
    netapp-master9.bkp.bf1.yahoo.com.51841 > node03.hff01.bf1.yahoo.com.ndmp: Flags [.], cksum 0x4369 (correct), ack 1593, win 126, options [nop,nop,TS val 1082429383 ecr 3183349829], length 0
23:48:25.824648 IP (tos 0x0, ttl 64, id 64324, offset 0, flags [DF], proto TCP (6), length 300)
    netapp-master9.bkp.bf1.yahoo.com.51841 > node03.hff01.bf1.yahoo.com.ndmp: Flags [P.], cksum 0xb554 (incorrect -> 0x9f87), seq 424:672, ack 1593, win 126, options [nop,nop,TS val 1082429411 ecr 3183349829], length 248
23:48:25.865269 IP (tos 0x0, ttl 64, id 64325, offset 0, flags [DF], proto TCP (6), length 52)
    netapp-master9.bkp.bf1.yahoo.com.51841 > node03.hff01.bf1.yahoo.com.ndmp: Flags [.], cksum 0x41ee (correct), ack 1625, win 126, options [nop,nop,TS val 1082429452 ecr 3183349859], length 0
23:48:25.912705 IP (tos 0x0, ttl 64, id 64326, offset 0, flags [DF], proto TCP (6), length 52)
    netapp-master9.bkp.bf1.yahoo.com.51841 > node03.hff01.bf1.yahoo.com.ndmp: Flags [.], cksum 0x4111 (correct), ack 1713, win 126, options [nop,nop,TS val 1082429499 ecr 3183349945], length 0
23:48:25.931694 IP (tos 0x0, ttl 64, id 64327, offset 0, flags [DF], proto TCP (6), length 52)
    netapp-master9.bkp.bf1.yahoo.com.51841 > node03.hff01.bf1.yahoo.com.ndmp: Flags [.], cksum 0x4058 (correct), ack 1849, win 137, options [nop,nop,TS val 1082429518 ecr 3183349964], length 0
23:48:26.168717 IP (tos 0x0, ttl 64, id 64328, offset 0, flags [DF], proto TCP (6), length 52)
    netapp-master9.bkp.bf1.yahoo.com.51841 > node03.hff01.bf1.yahoo.com.ndmp: Flags [.], cksum 0x3e2e (correct), ack 1929, win 137, options [nop,nop,TS val 1082429755 ecr 3183350201], length 0
23:48:27.199131 IP (tos 0x0, ttl 64, id 64329, offset 0, flags [DF], proto TCP (6), length 52)
    netapp-master9.bkp.bf1.yahoo.com.51841 > node03.hff01.bf1.yahoo.com.ndmp: Flags [.], cksum 0x35c5 (correct), ack 2021, win 137, options [nop,nop,TS val 1082430785 ecr 3183351232], length 0
23:48:27.199633 IP (tos 0x0, ttl 64, id 64330, offset 0, flags [DF], proto TCP (6), length 52)
    netapp-master9.bkp.bf1.yahoo.com.51841 > node03.hff01.bf1.yahoo.com.ndmp: Flags [.], cksum 0x3550 (correct), ack 2137, win 137, options [nop,nop,TS val 1082430786 ecr 3183351232], length 0
23:48:27.199989 IP (tos 0x0, ttl 64, id 64331, offset 0, flags [DF], proto TCP (6), length 52)
    netapp-master9.bkp.bf1.yahoo.com.51841 > node03.hff01.bf1.yahoo.com.ndmp: Flags [.], cksum 0x34f3 (correct), ack 2229, win 137, options [nop,nop,TS val 1082430786 ecr 3183351233], length 0
23:48:27.200327 IP (tos 0x0, ttl 64, id 64332, offset 0, flags [DF], proto TCP (6), length 52)
    netapp-master9.bkp.bf1.yahoo.com.51841 > node03.hff01.bf1.yahoo.com.ndmp: Flags [.], cksum 0x347e (correct), ack 2345, win 137, options [nop,nop,TS val 1082430787 ecr 3183351233], length 0
23:48:27.200690 IP (tos 0x0, ttl 64, id 64333, offset 0, flags [DF], proto TCP (6), length 52)
    netapp-master9.bkp.bf1.yahoo.com.51841 > node03.hff01.bf1.yahoo.com.ndmp: Flags [.], cksum 0x3425 (correct), ack 2433, win 137, options [nop,nop,TS val 1082430787 ecr 3183351234], length 0
23:48:27.228177 IP (tos 0x0, ttl 64, id 44593, offset 0, flags [DF], proto TCP (6), length 80)
    netapp-master9.bkp.bf1.yahoo.com.42181 > node03.hff01.bf1.yahoo.com.ndmp: Flags [P.], cksum 0xb478 (incorrect -> 0x8251), seq 336:364, ack 1249, win 148, options [nop,nop,TS val 1082430814 ecr 3337412624], length 28
23:48:27.228744 IP (tos 0x0, ttl 64, id 44594, offset 0, flags [DF], proto TCP (6), length 52)
    netapp-master9.bkp.bf1.yahoo.com.42181 > node03.hff01.bf1.yahoo.com.ndmp: Flags [.], cksum 0x9304 (correct), ack 1353, win 148, options [nop,nop,TS val 1082430815 ecr 3337417628], length 0
23:48:27.280832 IP (tos 0x0, ttl 64, id 64334, offset 0, flags [DF], proto TCP (6), length 52)
    netapp-master9.bkp.bf1.yahoo.com.51841 > node03.hff01.bf1.yahoo.com.ndmp: Flags [.], cksum 0x32fa (correct), ack 2561, win 148, options [nop,nop,TS val 1082430867 ecr 3183351314], length 0
23:48:27.293418 IP (tos 0x0, ttl 64, id 64335, offset 0, flags [DF], proto TCP (6), length 52)
    netapp-master9.bkp.bf1.yahoo.com.51841 > node03.hff01.bf1.yahoo.com.ndmp: Flags [.], cksum 0x3289 (correct), ack 2649, win 148, options [nop,nop,TS val 1082430880 ecr 3183351326], length 0
23:48:27.356189 IP (tos 0x0, ttl 64, id 64336, offset 0, flags [DF], proto TCP (6), length 52)
    netapp-master9.bkp.bf1.yahoo.com.51841 > node03.hff01.bf1.yahoo.com.ndmp: Flags [.], cksum 0x31c0 (correct), ack 2725, win 148, options [nop,nop,TS val 1082430942 ecr 3183351389], length 0
23:48:27.356587 IP (tos 0x0, ttl 64, id 64337, offset 0, flags [DF], proto TCP (6), length 52)
    netapp-master9.bkp.bf1.yahoo.com.51841 > node03.hff01.bf1.yahoo.com.ndmp: Flags [.], cksum 0x3167 (correct), ack 2813, win 148, options [nop,nop,TS val 1082430943 ecr 3183351389], length 0
23:48:28.033025 IP (tos 0x0, ttl 64, id 60241, offset 0, flags [DF], proto TCP (6), length 80)
    netapp-master9.bkp.bf1.yahoo.com.35558 > node03.hff01.bf1.yahoo.com.ndmp: Flags [P.], cksum 0xb478 (incorrect -> 0x5d1e), seq 336:364, ack 1249, win 170, options [nop,nop,TS val 1082431619 ecr 1932751266], length 28
23:48:28.033919 IP (tos 0x0, ttl 64, id 60242, offset 0, flags [DF], proto TCP (6), length 52)
    netapp-master9.bkp.bf1.yahoo.com.35558 > node03.hff01.bf1.yahoo.com.ndmp: Flags [.], cksum 0x6dd4 (correct), ack 1353, win 170, options [nop,nop,TS val 1082431620 ecr 1932756273], length 0
23:48:30.828998 IP (tos 0x0, ttl 64, id 64338, offset 0, flags [DF], proto TCP (6), length 80)
    netapp-master9.bkp.bf1.yahoo.com.51841 > node03.hff01.bf1.yahoo.com.ndmp: Flags [P.], cksum 0xb478 (incorrect -> 0x0f2b), seq 672:700, ack 2813, win 148, options [nop,nop,TS val 1082434415 ecr 3183351389], length 28
23:48:30.829793 IP (tos 0x0, ttl 64, id 64339, offset 0, flags [DF], proto TCP (6), length 52)
    netapp-master9.bkp.bf1.yahoo.com.51841 > node03.hff01.bf1.yahoo.com.ndmp: Flags [.], cksum 0x15c1 (correct), ack 2917, win 148, options [nop,nop,TS val 1082434416 ecr 3183354862], length 0
23:48:32.234307 IP (tos 0x0, ttl 64, id 44595, offset 0, flags [DF], proto TCP (6), length 80)
    netapp-master9.bkp.bf1.yahoo.com.42181 > node03.hff01.bf1.yahoo.com.ndmp: Flags [P.], cksum 0xb478 (incorrect -> 0x5aac), seq 364:392, ack 1353, win 148, options [nop,nop,TS val 1082435821 ecr 3337417628], length 28
23:48:32.235031 IP (tos 0x0, ttl 64, id 44596, offset 0, flags [DF], proto TCP (6), length 52)
    netapp-master9.bkp.bf1.yahoo.com.42181 > node03.hff01.bf1.yahoo.com.ndmp: Flags [.], cksum 0x6b62 (correct), ack 1457, win 148, options [nop,nop,TS val 1082435821 ecr 3337422636], length 0
23:48:33.039406 IP (tos 0x0, ttl 64, id 60243, offset 0, flags [DF], proto TCP (6), length 80)
    netapp-master9.bkp.bf1.yahoo.com.35558 > node03.hff01.bf1.yahoo.com.ndmp: Flags [P.], cksum 0xb478 (incorrect -> 0x3576), seq 364:392, ack 1353, win 170, options [nop,nop,TS val 1082436626 ecr 1932756273], length 28
23:48:33.039875 IP (tos 0x0, ttl 64, id 60244, offset 0, flags [DF], proto TCP (6), length 52)
    netapp-master9.bkp.bf1.yahoo.com.35558 > node03.hff01.bf1.yahoo.com.ndmp: Flags [.], cksum 0x4634 (correct), ack 1457, win 170, options [nop,nop,TS val 1082436626 ecr 1932761279], length 0
23:48:35.834285 IP (tos 0x0, ttl 64, id 64340, offset 0, flags [DF], proto TCP (6), length 80)
    netapp-master9.bkp.bf1.yahoo.com.51841 > node03.hff01.bf1.yahoo.com.ndmp: Flags [P.], cksum 0xb478 (incorrect -> 0xed81), seq 700:728, ack 2917, win 148, options [nop,nop,TS val 1082439421 ecr 3183354862], length 28
23:48:35.834937 IP (tos 0x0, ttl 64, id 64341, offset 0, flags [DF], proto TCP (6), length 52)
    netapp-master9.bkp.bf1.yahoo.com.51841 > node03.hff01.bf1.yahoo.com.ndmp: Flags [.], cksum 0xee21 (correct), ack 3021, win 148, options [nop,nop,TS val 1082439421 ecr 3183359868], length 0
23:48:37.197642 IP (tos 0x0, ttl 64, id 64342, offset 0, flags [DF], proto TCP (6), length 52)
    netapp-master9.bkp.bf1.yahoo.com.51841 > node03.hff01.bf1.yahoo.com.ndmp: Flags [.], cksum 0xe323 (correct), ack 3109, win 148, options [nop,nop,TS val 1082440784 ecr 3183361231], length 0
23:48:37.240537 IP (tos 0x0, ttl 64, id 44597, offset 0, flags [DF], proto TCP (6), length 80)
    netapp-master9.bkp.bf1.yahoo.com.42181 > node03.hff01.bf1.yahoo.com.ndmp: Flags [P.], cksum 0xb478 (incorrect -> 0x3304), seq 392:420, ack 1457, win 148, options [nop,nop,TS val 1082440827 ecr 3337422636], length 28
23:48:37.241021 IP (tos 0x0, ttl 64, id 44598, offset 0, flags [DF], proto TCP (6), length 52)
    netapp-master9.bkp.bf1.yahoo.com.42181 > node03.hff01.bf1.yahoo.com.ndmp: Flags [.], cksum 0x43c3 (correct), ack 1561, win 148, options [nop,nop,TS val 1082440827 ecr 3337427641], length 0
23:48:38.045301 IP (tos 0x0, ttl 64, id 60245, offset 0, flags [DF], proto TCP (6), length 80)
    netapp-master9.bkp.bf1.yahoo.com.35558 > node03.hff01.bf1.yahoo.com.ndmp: Flags [P.], cksum 0xb478 (incorrect -> 0x0dd0), seq 392:420, ack 1457, win 170, options [nop,nop,TS val 1082441632 ecr 1932761279], length 28
23:48:38.045808 IP (tos 0x0, ttl 64, id 60246, offset 0, flags [DF], proto TCP (6), length 52)
    netapp-master9.bkp.bf1.yahoo.com.35558 > node03.hff01.bf1.yahoo.com.ndmp: Flags [.], cksum 0x1e94 (correct), ack 1561, win 170, options [nop,nop,TS val 1082441632 ecr 1932766285], length 0
23:48:40.838874 IP (tos 0x0, ttl 64, id 64343, offset 0, flags [DF], proto TCP (6), length 80)
    netapp-master9.bkp.bf1.yahoo.com.51841 > node03.hff01.bf1.yahoo.com.ndmp: Flags [P.], cksum 0xb478 (incorrect -> 0xc032), seq 728:756, ack 3109, win 148, options [nop,nop,TS val 1082444425 ecr 3183361231], length 28
23:48:40.839431 IP (tos 0x0, ttl 64, id 64344, offset 0, flags [DF], proto TCP (6), length 52)
    netapp-master9.bkp.bf1.yahoo.com.51841 > node03.hff01.bf1.yahoo.com.ndmp: Flags [.], cksum 0xc62c (correct), ack 3213, win 148, options [nop,nop,TS val 1082444426 ecr 3183364872], length 0
23:48:42.246588 IP (tos 0x0, ttl 64, id 44599, offset 0, flags [DF], proto TCP (6), length 80)
    netapp-master9.bkp.bf1.yahoo.com.42181 > node03.hff01.bf1.yahoo.com.ndmp: Flags [P.], cksum 0xb478 (incorrect -> 0x0b5f), seq 420:448, ack 1561, win 148, options [nop,nop,TS val 1082445833 ecr 3337427641], length 28
23:48:42.247120 IP (tos 0x0, ttl 64, id 44600, offset 0, flags [DF], proto TCP (6), length 52)
    netapp-master9.bkp.bf1.yahoo.com.42181 > node03.hff01.bf1.yahoo.com.ndmp: Flags [.], cksum 0x1c23 (correct), ack 1665, win 148, options [nop,nop,TS val 1082445833 ecr 3337432647], length 0
23:48:43.033997 IP (tos 0x0, ttl 64, id 64345, offset 0, flags [DF], proto TCP (6), length 52)
    netapp-master9.bkp.bf1.yahoo.com.51841 > node03.hff01.bf1.yahoo.com.ndmp: Flags [.], cksum 0xb4bb (correct), ack 3289, win 148, options [nop,nop,TS val 1082446620 ecr 3183367067], length 0
23:48:43.043061 IP (tos 0x0, ttl 64, id 64346, offset 0, flags [DF], proto TCP (6), length 52)
    netapp-master9.bkp.bf1.yahoo.com.51841 > node03.hff01.bf1.yahoo.com.ndmp: Flags [.], cksum 0xb459 (correct), ack 3369, win 148, options [nop,nop,TS val 1082446629 ecr 3183367076], length 0
23:48:43.051408 IP (tos 0x0, ttl 64, id 60247, offset 0, flags [DF], proto TCP (6), length 80)
    netapp-master9.bkp.bf1.yahoo.com.35558 > node03.hff01.bf1.yahoo.com.ndmp: Flags [P.], cksum 0xb478 (incorrect -> 0xe629), seq 420:448, ack 1561, win 170, options [nop,nop,TS val 1082446638 ecr 1932766285], length 28
23:48:43.051920 IP (tos 0x0, ttl 64, id 60248, offset 0, flags [DF], proto TCP (6), length 52)
    netapp-master9.bkp.bf1.yahoo.com.35558 > node03.hff01.bf1.yahoo.com.ndmp: Flags [.], cksum 0xf6f3 (correct), ack 1665, win 170, options [nop,nop,TS val 1082446638 ecr 1932771291], length 0
23:48:43.055811 IP (tos 0x0, ttl 64, id 64347, offset 0, flags [DF], proto TCP (6), length 52)
    netapp-master9.bkp.bf1.yahoo.com.51841 > node03.hff01.bf1.yahoo.com.ndmp: Flags [.], cksum 0xb3ff (correct), ack 3433, win 148, options [nop,nop,TS val 1082446642 ecr 3183367089], length 0
23:48:43.064230 IP (tos 0x0, ttl 64, id 64348, offset 0, flags [DF], proto TCP (6), length 52)
    netapp-master9.bkp.bf1.yahoo.com.51841 > node03.hff01.bf1.yahoo.com.ndmp: Flags [.], cksum 0xb3ac (correct), ack 3501, win 148, options [nop,nop,TS val 1082446650 ecr 3183367096], length 0
23:48:43.255762 IP (tos 0x0, ttl 64, id 64349, offset 0, flags [DF], proto TCP (6), length 52)
    netapp-master9.bkp.bf1.yahoo.com.51841 > node03.hff01.bf1.yahoo.com.ndmp: Flags [.], cksum 0xb198 (correct), ack 3637, win 159, options [nop,nop,TS val 1082446842 ecr 3183367289], length 0
23:48:43.461305 IP (tos 0x0, ttl 64, id 64350, offset 0, flags [DF], proto TCP (6), length 52)
    netapp-master9.bkp.bf1.yahoo.com.51841 > node03.hff01.bf1.yahoo.com.ndmp: Flags [.], cksum 0xafdd (correct), ack 3669, win 159, options [nop,nop,TS val 1082447048 ecr 3183367494], length 0
23:48:43.461825 IP (tos 0x0, ttl 64, id 64351, offset 0, flags [DF], proto TCP (6), length 80)
    netapp-master9.bkp.bf1.yahoo.com.51841 > node03.hff01.bf1.yahoo.com.ndmp: Flags [P.], cksum 0xb478 (incorrect -> 0x9b1d), seq 756:784, ack 3669, win 159, options [nop,nop,TS val 1082447048 ecr 3183367494], length 28
23:48:43.502268 IP (tos 0x0, ttl 64, id 64352, offset 0, flags [DF], proto TCP (6), length 52)
    netapp-master9.bkp.bf1.yahoo.com.51841 > node03.hff01.bf1.yahoo.com.ndmp: Flags [.], cksum 0xae28 (correct), ack 4025, win 170, options [nop,nop,TS val 1082447089 ecr 3183367495], length 0
23:48:43.524028 IP (tos 0x0, ttl 64, id 64353, offset 0, flags [DF], proto TCP (6), length 80)
    netapp-master9.bkp.bf1.yahoo.com.51841 > node03.hff01.bf1.yahoo.com.ndmp: Flags [P.], cksum 0xb478 (incorrect -> 0x994f), seq 784:812, ack 4025, win 170, options [nop,nop,TS val 1082447110 ecr 3183367495], length 28
23:48:43.525372 IP (tos 0x0, ttl 64, id 64354, offset 0, flags [DF], proto TCP (6), length 52)
    netapp-master9.bkp.bf1.yahoo.com.51841 > node03.hff01.bf1.yahoo.com.ndmp: Flags [.], cksum 0xad96 (correct), ack 4057, win 170, options [nop,nop,TS val 1082447112 ecr 3183367558], length 0
23:48:43.525792 IP (tos 0x0, ttl 64, id 64355, offset 0, flags [DF], proto TCP (6), length 80)
    netapp-master9.bkp.bf1.yahoo.com.51841 > node03.hff01.bf1.yahoo.com.ndmp: Flags [P.], cksum 0xb478 (incorrect -> 0x93d6), seq 812:840, ack 4057, win 170, options [nop,nop,TS val 1082447112 ecr 3183367558], length 28
23:48:43.526695 IP (tos 0x0, ttl 64, id 64356, offset 0, flags [DF], proto TCP (6), length 52)
    netapp-master9.bkp.bf1.yahoo.com.51841 > node03.hff01.bf1.yahoo.com.ndmp: Flags [R.], cksum 0xad37 (correct), seq 840, ack 4118, win 170, options [nop,nop,TS val 1082447113 ecr 3183367559], length 0
23:48:47.252727 IP (tos 0x0, ttl 64, id 44601, offset 0, flags [DF], proto TCP (6), length 80)
    netapp-master9.bkp.bf1.yahoo.com.42181 > node03.hff01.bf1.yahoo.com.ndmp: Flags [P.], cksum 0xb478 (incorrect -> 0xe3b8), seq 448:476, ack 1665, win 148, options [nop,nop,TS val 1082450839 ecr 3337432647], length 28
23:48:47.253247 IP (tos 0x0, ttl 64, id 44602, offset 0, flags [DF], proto TCP (6), length 52)
    netapp-master9.bkp.bf1.yahoo.com.42181 > node03.hff01.bf1.yahoo.com.ndmp: Flags [.], cksum 0xf482 (correct), ack 1769, win 148, options [nop,nop,TS val 1082450839 ecr 3337437653], length 0
23:48:48.057484 IP (tos 0x0, ttl 64, id 60249, offset 0, flags [DF], proto TCP (6), length 80)
    netapp-master9.bkp.bf1.yahoo.com.35558 > node03.hff01.bf1.yahoo.com.ndmp: Flags [P.], cksum 0xb478 (incorrect -> 0xbe83), seq 448:476, ack 1665, win 170, options [nop,nop,TS val 1082451644 ecr 1932771291], length 28
23:48:48.058278 IP (tos 0x0, ttl 64, id 60250, offset 0, flags [DF], proto TCP (6), length 52)
    netapp-master9.bkp.bf1.yahoo.com.35558 > node03.hff01.bf1.yahoo.com.ndmp: Flags [.], cksum 0xcf52 (correct), ack 1769, win 170, options [nop,nop,TS val 1082451645 ecr 1932776297], length 0
23:48:52.258769 IP (tos 0x0, ttl 64, id 44603, offset 0, flags [DF], proto TCP (6), length 80)
    netapp-master9.bkp.bf1.yahoo.com.42181 > node03.hff01.bf1.yahoo.com.ndmp: Flags [P.], cksum 0xb478 (incorrect -> 0xbc12), seq 476:504, ack 1769, win 148, options [nop,nop,TS val 1082455845 ecr 3337437653], length 28
23:48:52.259579 IP (tos 0x0, ttl 64, id 44604, offset 0, flags [DF], proto TCP (6), length 52)
    netapp-master9.bkp.bf1.yahoo.com.42181 > node03.hff01.bf1.yahoo.com.ndmp: Flags [.], cksum 0xcce0 (correct), ack 1873, win 148, options [nop,nop,TS val 1082455846 ecr 3337442660], length 0
23:48:53.063818 IP (tos 0x0, ttl 64, id 60251, offset 0, flags [DF], proto TCP (6), length 80)
    netapp-master9.bkp.bf1.yahoo.com.35558 > node03.hff01.bf1.yahoo.com.ndmp: Flags [P.], cksum 0xb478 (incorrect -> 0x96dd), seq 476:504, ack 1769, win 170, options [nop,nop,TS val 1082456650 ecr 1932776297], length 28
23:48:53.064464 IP (tos 0x0, ttl 64, id 60252, offset 0, flags [DF], proto TCP (6), length 52)
    netapp-master9.bkp.bf1.yahoo.com.35558 > node03.hff01.bf1.yahoo.com.ndmp: Flags [.], cksum 0xa7b1 (correct), ack 1873, win 170, options [nop,nop,TS val 1082456651 ecr 1932781304], length 0
23:48:57.265063 IP (tos 0x0, ttl 64, id 44605, offset 0, flags [DF], proto TCP (6), length 80)
    netapp-master9.bkp.bf1.yahoo.com.42181 > node03.hff01.bf1.yahoo.com.ndmp: Flags [P.], cksum 0xb478 (incorrect -> 0x946b), seq 504:532, ack 1873, win 148, options [nop,nop,TS val 1082460851 ecr 3337442660], length 28
23:48:57.265538 IP (tos 0x0, ttl 64, id 44606, offset 0, flags [DF], proto TCP (6), length 52)
    netapp-master9.bkp.bf1.yahoo.com.42181 > node03.hff01.bf1.yahoo.com.ndmp: Flags [.], cksum 0xa540 (correct), ack 1977, win 148, options [nop,nop,TS val 1082460852 ecr 3337447666], length 0
23:48:58.069937 IP (tos 0x0, ttl 64, id 60253, offset 0, flags [DF], proto TCP (6), length 80)
    netapp-master9.bkp.bf1.yahoo.com.35558 > node03.hff01.bf1.yahoo.com.ndmp: Flags [P.], cksum 0xb478 (incorrect -> 0x6f36), seq 504:532, ack 1873, win 170, options [nop,nop,TS val 1082461656 ecr 1932781304], length 28
23:48:58.070430 IP (tos 0x0, ttl 64, id 60254, offset 0, flags [DF], proto TCP (6), length 52)
    netapp-master9.bkp.bf1.yahoo.com.35558 > node03.hff01.bf1.yahoo.com.ndmp: Flags [.], cksum 0x8011 (correct), ack 1977, win 170, options [nop,nop,TS val 1082461657 ecr 1932786310], length 0
23:49:02.271048 IP (tos 0x0, ttl 64, id 44607, offset 0, flags [DF], proto TCP (6), length 80)
    netapp-master9.bkp.bf1.yahoo.com.42181 > node03.hff01.bf1.yahoo.com.ndmp: Flags [P.], cksum 0xb478 (incorrect -> 0x6cc5), seq 532:560, ack 1977, win 148, options [nop,nop,TS val 1082465857 ecr 3337447666], length 28
23:49:02.271637 IP (tos 0x0, ttl 64, id 44608, offset 0, flags [DF], proto TCP (6), length 52)
    netapp-master9.bkp.bf1.yahoo.com.42181 > node03.hff01.bf1.yahoo.com.ndmp: Flags [.], cksum 0x7da0 (correct), ack 2081, win 148, options [nop,nop,TS val 1082465858 ecr 3337452672], length 0
23:49:03.075928 IP (tos 0x0, ttl 64, id 60255, offset 0, flags [DF], proto TCP (6), length 80)
    netapp-master9.bkp.bf1.yahoo.com.35558 > node03.hff01.bf1.yahoo.com.ndmp: Flags [P.], cksum 0xb478 (incorrect -> 0x4790), seq 532:560, ack 1977, win 170, options [nop,nop,TS val 1082466662 ecr 1932786310], length 28
23:49:03.076454 IP (tos 0x0, ttl 64, id 60256, offset 0, flags [DF], proto TCP (6), length 52)
    netapp-master9.bkp.bf1.yahoo.com.35558 > node03.hff01.bf1.yahoo.com.ndmp: Flags [.], cksum 0x5872 (correct), ack 2081, win 170, options [nop,nop,TS val 1082466663 ecr 1932791315], length 0
23:49:07.277297 IP (tos 0x0, ttl 64, id 44609, offset 0, flags [DF], proto TCP (6), length 80)
    netapp-master9.bkp.bf1.yahoo.com.42181 > node03.hff01.bf1.yahoo.com.ndmp: Flags [P.], cksum 0xb478 (incorrect -> 0x451e), seq 560:588, ack 2081, win 148, options [nop,nop,TS val 1082470864 ecr 3337452672], length 28
23:49:07.277757 IP (tos 0x0, ttl 64, id 44610, offset 0, flags [DF], proto TCP (6), length 52)
    netapp-master9.bkp.bf1.yahoo.com.42181 > node03.hff01.bf1.yahoo.com.ndmp: Flags [.], cksum 0x5601 (correct), ack 2185, win 148, options [nop,nop,TS val 1082470864 ecr 3337457677], length 0
23:49:08.080848 IP (tos 0x0, ttl 64, id 60257, offset 0, flags [DF], proto TCP (6), length 80)
    netapp-master9.bkp.bf1.yahoo.com.35558 > node03.hff01.bf1.yahoo.com.ndmp: Flags [P.], cksum 0xb478 (incorrect -> 0x1fec), seq 560:588, ack 2081, win 170, options [nop,nop,TS val 1082471667 ecr 1932791315], length 28
23:49:08.081622 IP (tos 0x0, ttl 64, id 60258, offset 0, flags [DF], proto TCP (6), length 52)
    netapp-master9.bkp.bf1.yahoo.com.35558 > node03.hff01.bf1.yahoo.com.ndmp: Flags [.], cksum 0x30d4 (correct), ack 2185, win 170, options [nop,nop,TS val 1082471668 ecr 1932796320], length 0
23:49:12.282406 IP (tos 0x0, ttl 64, id 44611, offset 0, flags [DF], proto TCP (6), length 80)
    netapp-master9.bkp.bf1.yahoo.com.42181 > node03.hff01.bf1.yahoo.com.ndmp: Flags [P.], cksum 0xb478 (incorrect -> 0x1d7a), seq 588:616, ack 2185, win 148, options [nop,nop,TS val 1082475869 ecr 3337457677], length 28
23:49:12.283157 IP (tos 0x0, ttl 64, id 44612, offset 0, flags [DF], proto TCP (6), length 52)
    netapp-master9.bkp.bf1.yahoo.com.42181 > node03.hff01.bf1.yahoo.com.ndmp: Flags [.], cksum 0x2e61 (correct), ack 2289, win 148, options [nop,nop,TS val 1082475869 ecr 3337462684], length 0
23:49:13.087057 IP (tos 0x0, ttl 64, id 60259, offset 0, flags [DF], proto TCP (6), length 80)
    netapp-master9.bkp.bf1.yahoo.com.35558 > node03.hff01.bf1.yahoo.com.ndmp: Flags [P.], cksum 0xb478 (incorrect -> 0xf846), seq 588:616, ack 2185, win 170, options [nop,nop,TS val 1082476673 ecr 1932796320], length 28
23:49:13.087619 IP (tos 0x0, ttl 64, id 60260, offset 0, flags [DF], proto TCP (6), length 52)
    netapp-master9.bkp.bf1.yahoo.com.35558 > node03.hff01.bf1.yahoo.com.ndmp: Flags [.], cksum 0x0933 (correct), ack 2289, win 170, options [nop,nop,TS val 1082476674 ecr 1932801327], length 0
^C
141 packets captured
142 packets received by filter
0 packets dropped by kernel
